,reviewId,userName,userImage,content,score,thumbsUpCount,reviewCreatedVersion,at,replyContent,repliedAt
0,gp:AOqpTOGQLk9UxJDQOOjw7m2T16zlSHtdVHkysRQbyh2NiImuB7POmGcYZV-L3TXVvcQ8RMnyhTWbkcKhoge_sQ,Elma Dania,https://play-lh.googleusercontent.com/a-/AOh14GgNTF61lSvqY57nKG8jxXzavtFBytd0ZdnbS8btfQ,Sudah berhari-hari saya gabisa buka aplikasi ini. Sudah coba saya uninstal dan instal kembali masih tetep gabisa d buka. Yg ada cuman tampilan layar tulisan bibit doang lamaaaaa banget sampe lampu layar mati tetep gitu mulu. Entah apa yg merasukimu 😿,2,5,3.10.1,2021-06-07 12:09:02,"Hai kak Elma, silahkan coba force close & clear cache terlebih dahulu, lalu buka kembali aplikasi Bibitnya. Jika masih terkendala & pada Play Store aplikasi Bibit tersedia versi terbaru, silahkan diupdate dulu ya kak. Jika kendala masih terus terjadi, kakak bisa hubungi layanan live chat Bibit/WA +622150864230 agar kami cek lebih lanjut. Trims",2021-06-07 23:23:57
1,gp:AOqpTOFmzSm5WyvEo0iBmBc5fg-WCTkUYwHQHLXY7I9_3wJLhXMifkaGv0rKnkYcV-555cHorRz22_Q1YGYAQQ,ajeng cantik,https://play-lh.googleusercontent.com/a/AATXAJzdl_aqkxe8ptM6gAZna63Ws0seEEWyAUl3QXOs=mo,aplikasi bibit sangat mudah di pahami hayuk yang mau belajar investasi segera dwonload APK bibit dan masukan kode referal 'GURIH' supaya kita sama sama dapat cashback 25k. Buruan gabung di aplikasi bibit. Mantap,5,9,3.10.1,2021-06-08 05:55:07,,
2,gp:AOqpTOHcZbcCW2C8R4yUArwp8tlfRSAYByS0c1WvuCOtbAq2oZFojkw-8nt8P-K5t2cPyNw815g9__mmjuAW6g,Black_Star Gaming,https://play-lh.googleusercontent.com/a-/AOh14Ggp4f2uz8E6fd0JBwaPrIxW6z11_xMS2KS1d5_p,"Ngga lagi"" pake aplikasi ini, mau top up aja nunggu berhari"" baru msk dana'a dan mau jual aja harus nunggu berhari"" juga cairnya.. SAMPAH, mending gunakan aplikasi AJAIB",1,3,3.10.1,2021-06-07 14:09:58,"Hai kak, pembelian & penjualan reksadana memang tidak realtime karena ada proses verifikasi dari Manajer Investasi. Jadi prosesnya lebih lama dgn batas waktu max 2 hari kerja. Weekend & Libur Nasional tidak terhitung sbg hari kerja, proses dilanjut kembali pada hari kerja berikutnya. More info silakan hubungi live chat Bibit/WA +622150864230. Trims",2021-06-07 23:18:45
3,gp:AOqpTOEPb_8PvQ1tCSdAFeaqoEAvzx89oCy60nYQc4_gmgxxIYIA2oy-8i4mjXPxavEDzBNoAFrr2woPgmDSUg,Hamzah Furqan,https://play-lh.googleusercontent.com/a-/AOh14GirsfEXNEs3GvxCHenqVDH8i-EqYrRmeBkSkDTg,"Oh mimind ku tercinta, aku telah mengatakannya dengan cs kalian, tapi masih kurang puas, jadi aku ingin berkata langsung dengan pengembang apk ini bahwa, Tolong Sediakan Fasilitas Top Up/Pembayaran Dari Bank² Syariah Kususnya BSI Dan Muamalat. Kan gak lucu kami para nasabah yg menggunakan fitur syariah tapi tidak bisa melakukan pembayaran menggunakan bank syariah. Masak tidak ada perubahan hingga saat ini, padahal dah lama bertransaksi di bibit..",5,36,3.10.1,2021-06-07 01:11:29,,
4,gp:AOqpTOGK-OtI9wlohlI_6EUhCYKZvbdPYoDgTThE9vFQHh4qov0mkLogaAjZGUh8Rdb6B4B2n3nQRLoYPmB3tQ,gadis mudah,https://play-lh.googleusercontent.com/a/AATXAJz1k89pT5d038uMp-94WKj10hK67E_O-u5RAZbA=mo,"bagus, aplikasi yang sangat membantu untuk kita yang ingin masa depannya cerah, langsung saja masukan ( GURIH ) kode referal supaya dapat bonus cashback 25k. aplikasi ini sudah terdaftar di OJK..",5,80,3.10.1,2021-05-30 15:49:44,,
5,gp:AOqpTOFhtVtsKvAdA2-kxEedc8hOYorSgzvgQU_-0nuEbAPexcoVCcUxEq3jgwLbZ8s8WRSIryXLUPj3SRANLQ,Ano Nim,https://play-lh.googleusercontent.com/a-/AOh14GiFbv3nUoJ_2xWfmw3VopPBhOXjeHOs6xR2DqTneA,"Saya kasih bintang 2 karna ga bisa hps akun, saya sudah mengganti nomor telepon jd di akun bibit lama mau di ganti sm nomor yg baru tp gak bisa karna gak sengaja npas pertama x download malah tekan register bukan login alhasil nomor barunya terdaftar di akun bibit sedangkan satu akun cuma bisa satu ktp, niat nya mw hapus akun aja biar nomor yg baru bisa ke pakek di akun bibit yg lama tp gak bisa, gak ada fitur hapus akun.. Sayang sekali",2,6,3.10.1,2021-06-01 15:56:28,"Hai kak, terkait kendalanya bisa dibantu dengan tim support kami ya. Silahkan kakak langsung hubungi tim support melalui layanan live chat di aplikasi Bibit atau WA di nomor +622150864230 agar dapat kami bantu tangani lebih lanjut. Terimakasih",2021-06-01 23:33:04
6,gp:AOqpTOE_HHF2g7J131nDHBBpAeo6yFlA-42IKzM2tYieQR1RhLfs6-Gs3n1T3XN7FSWMtNFA8wp69SSPFzI_5g,Wira Kusuma,https://play-lh.googleusercontent.com/a/AATXAJyfEWP9qyYM661g751pAIJaweYI34RSVzPafdDu=mo,"Secara umum aplikasinya oke banget, aku suka Tapi ketika mau top up lagi kok ga bisa yaa, Apa mungkin sedang ada perbaikan? Mohon penjelasannya🥰",3,0,3.10.1,2021-06-07 14:28:15,,
7,gp:AOqpTOEfpv9-Bgbmj3Aw_sS2uktbZsIcwCg41e1ry-vXYxma1LrJYM9ias_iqEE7ksHDoX5sltpHT5ILjVIFaQ,Rahma Safhenta,https://play-lh.googleusercontent.com/a-/AOh14GhzijRF1stjhbF0y8d9Pn1wswrq7dg_s2Rssiqghg,"Bagus banget, bisa buat nabung buat nikah wkwk.. Kalian bisa gabung dengan kode -> balsemmerah , Dan dapatkan cash back 25rb.. Semangatt",5,0,3.10.1,2021-06-08 05:20:47,,
8,gp:AOqpTOExVws7NUtkiR4hLC6rE8ZG8vS4YWjzyhL2RZPu7W89cwjYGDHd2-eGx5yJiQT6Z9hr6WvtdxqGVkP25Q,Arden Ridho Ilham Syawalaxa,https://play-lh.googleusercontent.com/a-/AOh14Gi0OrvaQ3YMqZHhFPK003hXBGrCHpDxhnqup0ngwQ,Kode Cashback : INVESRI1 Aplikasi yang sangat membantu belajar menabung dan berinvestasi untuk segala kalangan. Sudah terdaftar di OJK juga.,5,0,3.10.1,2021-06-08 01:39:17,,
9,gp:AOqpTOFWdPmrC5Olmpzs8V3BG1M5a8HGnMyfyYKMxfhJ6YDp86UYMzRqA8FVkyAHnSBByzCAiBUlZuMid6jSDA,RW,https://play-lh.googleusercontent.com/a-/AOh14Gjsp3QboQHXCSjIpoWk_Z28uGb28zZbo7HtvJ9Tdw,Per hari ini aku move ke Bibit karena proses pembelian & penjualan lebih mudah & cepet daripada aplikasi sebelah. CS nya juga fast response via chat. Aku suka Bibit.,5,50,3.10.1,2021-06-02 14:27:04,,
10,gp:AOqpTOEVhpyq3LZY8jkRS2t5hZCBSVfQKx7kp_Aou7hHX9ghhQ0j5Qeu3xPzi7MgUPaDuUSjYO4LLzD_pUPbfA,Yanuar Kurnianto,https://play-lh.googleusercontent.com/a/AATXAJyCoSS8dR94P0AR3TIbTtajMOEYrcnteegQC8bA=mo,"Aplikasi yang memudahkan untuk orang awam yang ingin berinvestasi. Pakai kode referal ini ""CUSIN"" dan dapatkan cashback Rp 25.000",5,2,3.10.1,2021-06-02 15:53:50,,
11,gp:AOqpTOEgvizzWsJFEeSYJ7w3R-u5uze3Spa7HMtckM_qF4ynigwbr1529iqahLw6dxMS4rMdIwv3VKByOeEwwQ,NANDA ELIANA,https://play-lh.googleusercontent.com/a-/AOh14GjZlIHuxTOzrXeWP8z3vJaH1yVwLQ6dGY60otklfA,"masukkan kode referal ""nandael"" (tanpa petik, huruf kecil semua) untuk dapat cashback sampe 25k ya gaisss.. selamat berinvestasi 🤗",5,0,3.10.1,2021-06-02 11:11:16,,
12,gp:AOqpTOExn-wbR5GYz2BCVvVWEFje5PSm9sg445uhLOpsr47tEp6k7rF5_QsrPv4OK9TDXUA3nIx_C9hfH6AemQ,One Tumiang,https://play-lh.googleusercontent.com/a/AATXAJyDGWE6wgJV3AucheykLu0yIzKGKMd7-7P5GMVQ=mo,"Tampilan aplikasi mudah di mengerti, kedepan nya Manajer Invertasinya di tambah lagi, terus di kasi penjelasan penyebab atau akibat dari naik turunya laba atau rugi sebuah reksadana?",4,2,3.10.1,2021-06-04 17:11:11,,
13,gp:AOqpTOFKrtEbjIM7fML6nsqPgQi_-YrgoaOUbNlCUfE1kQLYDYENZN6cu8ctBjNcKg0NUMC5QiBR9FmPXmsM0w,Arin Adinda,https://play-lh.googleusercontent.com/a/AATXAJzdx_s49bC6-T3Tu-7y72750qOgxbBD0zdC9s9I=mo,"Yuk untuk kalian yang ingin dpet cashback 25k, bisa pakek kode refferial aku ya. Masukkan aja kode (ardinda). Terimakasih :)",4,0,3.10.1,2021-06-01 12:04:51,,
14,gp:AOqpTOGJ6m76YkaIu-j00s62nBLBjrZm1JXP89EV554IqMDucY57sJzij-i0WviZy5D3C20toe2XLWmuHGorbw,sabhara perintis,https://play-lh.googleusercontent.com/a/AATXAJx1qj_mDcAagbQF7cs2O7H-cQDE-0lviG3OJCDi=mo,"Pembelian yg yg lambat dan penjualan yang lambat terkesan menahan deposit nasabah, ketika pencairan tiba2 afa perubahan nilai jual sangat aneh ketika investasi telah berhasil terjual tdk ada notifikasi bahwa dana sudah masuk rekening",1,5,3.10.1,2021-06-03 11:12:09,"Hai kak, pencairan reksadana mengikuti NAB jual yg kakak dapatkan dan akan dikirim Bank Kustodian ke rekening yg terdaftar di Bibit sesuai regulasi OJK maks 3 hari kerja utk RD Pasar Uang dan 7 hari kerja utk RD Saham & Obligasi. Pastikan rekening kakak aktif dan untuk info lebih lanjut hubungi layanan live chat Bibit/WA +622150864230. Terimakasih",2021-06-04 02:58:16
15,gp:AOqpTOEsdfxKJWKj6mB-AVHqHyWTeLJORgInyZjQWzmvDcGze3IHHmaNHVYXTTb0crEsHFOoBuaTQBdcMn27FQ,Jono Joni,https://play-lh.googleusercontent.com/a/AATXAJwpVguwwCKLxn_qsEA_UXa4ZGYTiUg_JrAZ4-S8=mo,Apk rekomendasi banget buat kalian yang ingin nabung saham tp belom mengerti apa itu saham.. saran seh pencairan dana semoga bisa dipercepat jangan 7 hari hehehe,5,5,3.10.1,2021-05-27 15:43:44,,
16,gp:AOqpTOGockvzEPFPOUHZR-mv2-lV7MfbI8Iw6YMPW_Iug7cIScdZLWHULBFVoSaXkAtS45rwdOrsXPLHq8wJKA,Audrey Ang,https://play-lh.googleusercontent.com/a-/AOh14GgWpzf7VG3AQUII6N-3ERUkO4911StTzBbs0AQdOg,Akhir-akhir ini UInya agak error. Layer displaynya menumpuk dan tidak bisa dibuka. Apakah ada solusi ? Karena tidak ada update aplikasi terbaru yang tersedia.,2,3,3.10.1,2021-06-03 04:28:20,"Hai kak Audrey, mohon maaf atas kendalanya. Untuk masalah kakak silahkan coba force close & clear cache terlebih dahulu, lalu buka aplikasi Bibitnya kembali setelah menunggu 5 menit ya. Jika masih terkendala harap langsung menghubungi layanan live chat Bibit/WA +622150864230 agar tim support kami dapat bantu tangani lebih lanjut. Terimakasih",2021-06-04 03:29:17
17,gp:AOqpTOG4QNkBboSTxruNm92vTV9cT88uRu3h22xSSOHTGshaECY7xlhwg6Vdjsbsn3L4bzgW0_HuRRIP2jgU3Q,Fery Hilmi,https://play-lh.googleusercontent.com/a/AATXAJxOjVOdCyOiJaOsjA3QpRiV8C8J6XIUnUDvFH1-=mo,"keren sih, gw jadi bisa tau pasar modal, saham dsb, tapi untuk saran aplikasinya mohon di buat untuk lebih simpel lagi yaa, tapi untuk sejauh ini masih oke..",5,4,3.10.1,2021-06-01 10:47:06,,
18,gp:AOqpTOGX1U3S24c7oCf-1734ojP3WsyQhfkguDAsWsDAOr0R6DyNilWYqIrH5ahpuZfywVpMc9_rqJMhNu0XMA,Odo Tedy,https://play-lh.googleusercontent.com/a-/AOh14Giq_pLvGjGvcJFcBu9hdxU8rD_adu0G0aX7oAlVQQ,"Saya mau ikutan tpi pas register minta nomor rekening saya orang kampung gk nyimpen uang di bank, klo ovo, dana, gopay punya saya, gk jadi register, smoga jadi evaluasi.",2,5,3.10.1,2021-05-31 04:40:59,"Hai kak Tedy, mohon maaf kak utk registrasi harus menggunakan KTP & Rekening Bank atas nama kakak pribadi yg terdaftar di Indonesia. Jika belum punya Rekening bisa buat dulu ya kak, sekarang sdh ada kok layanan buka rekening online jadi gak perlu keluar rumah utk buat rekening. More info hubungi layanan live chat Bibit/WA +622150864230. Terimakasih",2021-06-01 22:56:24
19,gp:AOqpTOHgigoi3ggPiE9L8EkuTXwaVgV_OwsWy5yyORS2uds2mH0QvkZ75nIvn7sbR0Q6yeq6fi36xkVso5dWhA,Farhan Adriansyah,https://play-lh.googleusercontent.com/a-/AOh14GjA8F-kcJxWUOya2x_A04SUll-nNpQudnzR_XnUig,"Saya jual reksadana tpi belum dikirim juga sudah satu minggu lebihhh, katanya maksimal transfer 7 hari, walaupun gk bnyk saya tetep rugi merasa di tipu",1,5,3.10.1,2021-05-28 18:35:11,"Hai kak Farhan, mohon maaf atas kendala yg kakak alami. Pastikan kakak sudah cek mutasi rekening yg terdaftar di Bibit per 11 s.d 25 Mei 2021 ya. Sebagai tindak lanjut dari Bibit, tim kami sudah menghubungi kakak melalui layanan live chat yg ada di aplikasi Bibit. Mohon konfirmasinya melalui chat tersebut ya kak. Terimakasih",2021-05-31 05:42:54
20,gp:AOqpTOGZuN9vfE_i9sgW9hGxLsrGM4WlM3RBsBXFTt4dyb2myqTG9-6OjT0CXL9vDdohgu3pbcBMm3H_EErkJg,Hari Cahyo,https://play-lh.googleusercontent.com/a-/AOh14GjgB9ox8N7l6njRWe62gBXhu3M-CMzxIioGQ0gN,"Pokoknya kita mau belajar dan faham apa itu Reksadana.saham,pasar uang dll itu kita gk akan bgg dan kita harusnya tau setiap perusahaan itu ada kebijakan² tertentu contohnya kyak proses pencarian, pembelian pokok kita mau blajar dan bertanya itu saya rasa udah ada jawab.an kok ..saham, Reksadana pasar uang itu main sabar gk sabar tolong jgan coba ² ini mending cari kerja sampingan yg lain saja yg penting HALAL BROOOOOOOO",4,29,3.10.1,2021-06-01 16:49:54,,
21,gp:AOqpTOGpLt0gg1Asl06HsLDm_twNYwAJxwMtA1WLv780GflEYEMryulGDpDuFP7MZPJjxQmGrEHbgccauwJb7w,Aditya Firmansyah,https://play-lh.googleusercontent.com/a-/AOh14GjKbVLdqH1eyUyYydeHy_W5n76KE0xlycYWFtAdeA,"Alhamdulillah dg adanya bibit kita semua bisa tau skaligus bisa berinvestasi dg aman dan baik, dtambah CS yg fast respon dan baik. Salam cuan & Salam investasi.",5,0,3.10.1,2021-06-01 05:46:22,,
22,gp:AOqpTOG0J19sOdVFjnjmeWw7-Q2xI1CoQBmxIPPzc9iHMeLCDdlkO9MGDvy57I3qWQSjaZ0NYc2U80z_hX7TGA,Dean Adha,https://play-lh.googleusercontent.com/a-/AOh14GihmbxOGrcpn2-_-Qd6vljKX55HFzjsJYSiCZED,"Aplikasi nya uda bagus, cuman pencairan nya tolong rentang waktu nya kelamaan,tingkatkan lagi untuk dana pencairan nya biar lebih bisa instan",4,1,3.10.1,2021-05-31 09:38:14,,
23,gp:AOqpTOGgpUxUwxI_5wFQKvmNv7X88AwYQyJrzxqFl-gB1lNCjXeMM9wDChCdfZm_ooNL7GIJ0B-ATiSaM3MAiA,Nia Cahya,https://play-lh.googleusercontent.com/a-/AOh14GhhsXzTudIYoXafVBhMse6oPv0XnwBYO1gh5ITFmg,"Bagi pengguna baru bisa masukin kode referal ini (pwznrfh) biar dpt cashback 25rb dan bisa buat invest. App nya bagus mudah dipahami apalagi ada grup di telegram utk berbagi informasi, sangat membantu sekali. Selalu jaga kinerjanya ya 🥳🤗",5,1,3.8.0,2021-06-04 00:51:25,,
24,gp:AOqpTOGQzworT-SD7g4arLLBlMghsFxNnSZgsWaEmPVOP3bLEk1llNm1ah8PQD6NM50Dg0meR6R9YIGlINN-wg,Bayu Raharjo,https://play-lh.googleusercontent.com/a-/AOh14GisrphqrmMVTkYf3Xk7LCaGg3N6BQw0SQ5VkgAReA,"Yang mau dapetin cashback Rp. 50.000 masukkan kode teferal ini ""bayraharjo"" (tanpa tanda petik). Ayo dapetin cashback secara cuma cuma",5,2,3.10.1,2021-05-31 11:47:25,,
25,gp:AOqpTOE_Grzf8k7DSFoOrSWitbFdP-2SAQ17bBxjxn8pf9SKGLikmukG6BE3dIcylQPuKMDHVGBfDBjdnPJI6g,Rahman Aditya,https://play-lh.googleusercontent.com/a-/AOh14Gj6z92gbTvpgLD2XmIO5hku-_bDecKvMP_sRNsPXg,aplikasi bagus penggunaan sangat mudah membantu sangat membantu fitur-fiturnya klo boleh minta di berikan tempat untuk informasi idx di hari ini,4,1,3.10.1,2021-05-31 21:20:45,,
26,gp:AOqpTOH_6EDMlLUQhO3fj3XWJMrx1xhZ0MybJ1CaAK_PU7LMcvuUhWc1NgOtfHh5VycZboxJ8CvErqvfc1uXsg,Joni Hariadi S,https://play-lh.googleusercontent.com/a-/AOh14GgN0k-wgrmzTXY5bveYpmKeYkinMsawhoSQzvcUlw,Proses pencairan sangan memakan waktu. Menunggu 3 hari sampai dapat email balasan. Dan dalam email suruh menunggu lagi 7 hari bursa.,1,6,3.10.1,2021-06-03 21:06:06,"Hai kak Joni, untuk transaksi akan berhasil maks 2 hari kerja ya kak. Utk pencairan dana dikirim oleh Bank Kustodian ke rekening kakak yg terdaftar di Bibit berdasarkan ketentuan OJK maks 3 hari kerja utk RD Pasar Uang dan maks 7 hari kerja utk RD Saham & Obligasi. Info lebih lanjut silahkan hubungi live chat Bibit/WA +622150864230. Terimakasih",2021-06-07 01:32:44
27,gp:AOqpTOEnq5ZhICr5XT7dXfJcAC_hDPot37QBYoaW8PGdt-b-0z5a2oWJ86GJMKWhb52vyOq-4HQajgGh2yu17w,Febby Yonika,https://play-lh.googleusercontent.com/a-/AOh14GhrMH8-w1p6gWFRZAR_hHTCVZ-udzUyChTwbb1N4A,"Bismillah. Silahkan gunakan kode referial ""febbyonika"" saat pendaftaran untuk mendapatkan cashback.. semangat ❤",5,0,3.10.1,2021-06-06 03:20:31,,
28,gp:AOqpTOHQriTYfI9o8XSuJwA34kEJBCL-fZwtgYzieHB46MTKFByCeACdX4eHA7NIFRsKe8H9-o0MCcScfdH4Jw,Ursula Nangur,https://play-lh.googleusercontent.com/a-/AOh14GiCSOucNJwV6OpARYXej6Y9U9vTTcxZtLuIhwW8mw,Bintang satu aja kesal...... Seharian mau upload KTP aja ngga mau terus. Padahal sudah tertarik mau investasi.. akhirnya duit nganggur di gopay lah,1,5,3.10.1,2021-05-25 10:16:51,"Hai kak Ursula, terkait kendalanya silahkan kakak coba untuk force close & clear cache terlebih dahulu ya, lalu kakak buka aplikasi Bibit nya kembali. Jika masih terkendala harap langsung menghubungi layanan live chat Bibit atau WA ke nomor +622150864230 agar dapat tim kami tangani lebih lanjut. Terimakasih",2021-05-27 09:29:22
29,gp:AOqpTOH2cEdFZNkhzrlBEgXBqf5hVX3lo-APgX60yMoRAroafDezJXGmxNxDeRU6KrLdA9KpCFNkJyvQBoE4zA,Rafi Albara,https://play-lh.googleusercontent.com/a-/AOh14Gg6yKlwi_mCb_yteCz48jbfepRGZDO0yvjw63BGdw,"Tolong,tambahkan E-payment DANA,agar saya tidak menunda keinginan berinvestasi di bibit. Saya tidak bisa pakai gopay karna nomer saya hilang.",1,3,3.10.1,2021-06-01 15:09:52,"Hai kak Rafi, di Bibit sudah bisa melakukan pembayaran melalui DANA kok. Untuk panduan metode pembayaran tersebut, silahkan kakak cek pada https://faq.bibit.id/id/. Jika kakak mengalami kendala atau memiliki pertanyaan, kakak bisa langsung hubungi layanan live chat Bibit atau WA ke +622150864230 agar tim kami bisa tangani lebih lanjut. Terimakasih",2021-06-01 22:52:54
30,gp:AOqpTOEFoR5oVxK9EN0ccw72yFXgp3BSFw80zFnrTr6gv_z9StB0YP2oGiSlLSJwe2JScXl-W0oMwKNVMo8c1Q,IKHSAN,https://play-lh.googleusercontent.com/a-/AOh14Gj5pdsoy8njGSVrfRcjWydvmT9_3Vm72w6RiZjE,aplikasi yang sangat bagus untuk yang mau investasi bagi yang mau masa depan nya cerah.jangan lupa gunakan kode referal: buruansukses,5,0,3.10.1,2021-06-03 15:42:56,,
31,gp:AOqpTOEmeR7tnMfd4qs66yR5KTgIMuu2_iMQgqC7mFiZee3kNXMRThR8M1jplR-D5tDGmGM5tTw-KdysJtECdg,ladyfish snakehead,https://play-lh.googleusercontent.com/a-/AOh14GhRH_QjVIyjUBf38KJCEEp1T4U-9zpZxdMv5KXWS6Y,"Aplikasi bagus. Tapi untuk dana transaksi terlalu lama! Deposit masuk lama , penarikan juga sama lama ,",1,0,3.10.1,2021-06-05 07:52:36,"Hai kak, terkait hal ini karena pembelian dan penjualan reksadana tidak realtime. Ada proses verifikasi dari Manajer Investasi jadi prosesnya memakan waktu dengan batas maksimal 2 hari kerja. Weekend (Sabtu-Minggu) dan Libur Nasional tidak terhitung sebagai hari kerja. More info silakan hubungi live chat Bibit/WA di nomor +622150864230. Terimakasih",2021-06-07 02:28:53
32,gp:AOqpTOFbj_ziinlbpb_QUnKA2bCoUTAKdzerZPfJ2GsbBIC3dS4V3aBAHLwQ2hYlHeiejKz7Rw9cnZsrVd5qYQ,Keywans,https://play-lh.googleusercontent.com/a/AATXAJyZYq0A3CvKNqQcwVpPLfa6cicbwg8IdTXbPyMo_g=mo,Gak bisa daftar pake surat keterangan ktp sementara Padahal di bagian kiri kertasnya sudah ada tanda tangan saya Mohon solusinya min,1,2,3.10.1,2021-05-25 13:54:54,"Hai kak, untuk masalah registrasi harap hubungi tim support melalui layanan live chat di aplikasi atau WA di nomor +622150864230 agar masalah kakak dapat langsung kami bantu. Terimakasih",2021-05-27 09:31:53
33,gp:AOqpTOHFHr9Lu3WbteBw63oebhfTEHIhnieN1BmoOKyfMrdz0P4o3pFUKoxz_lIfnyQSp479L4P6DynbRevNXg,Revaldy Panjaitan,https://play-lh.googleusercontent.com/a-/AOh14GgUwu8yRdi2vT8enmYvVSoaxd6fL3OIvt3nHVS2pQ,"Dia bilang saya kena biaya transfer wong jelas2 bibitnya sendiri yg bilang saya dapat cashback Rp3500 saya lihat dengan mata kepala saya sendiri, sayangnya tidak sempat saya ss karena sdh keduluan emosi sm ni apk",1,8,3.10.1,2021-06-07 09:57:48,"Halo kak, cashback penjualan berupa voucher cashback ya bukan uang. Jadi nominal yg ditransfer ke rekening tetap terpotong biaya transfer oleh bank jika rekening kakak berbeda dgn bank penampung. Cashback penjualan maks 3x per akun selamanya & baru bisa digunakan jika nominalnya sdh mencapai 10rb. More info hubungi live chat/WA +622150864230. Trims",2021-06-07 23:09:20
34,gp:AOqpTOHxbzHtu5SVTjwODn1NP2RQUwY2ck1k5X7jYpnd3CEx11cXEGoqwnw-3RGlI9vgMdd4o-wxokjL5JfbbA,Narko,https://play-lh.googleusercontent.com/a-/AOh14GirUCFdqw0QbCxvsr7_NipZTJwxtz4Pow0bc39vcQ,"Sistem Top-up atau pembelian masih terlalu RIBET, harus ada bukti tranfer dan harus berasal dari rekening sesuai nama yang terdaftar. Kurang simple, alangkah lebih baik jika dimudahkan, misalnya dengan ditambahkan metode tranfer dari Virtual Account (VA), tranfer via Toko (Alfamart,Indomart,PT.Pos,dsb) Update: Skrg sudah tersedia banyak pilihan metode pembayaran. 4 bintang dulu ya, kalau profit ntar ditambah lagi 5 bintang.",4,67,3.8.0,2021-05-16 20:31:57,Terima kasih untuk input nya. Untuk metode fitur pembayaran baru akan kita rilis dalam 1-2 minggu kedepan. Silahkan coba lagi :),2019-04-21 03:31:12
35,gp:AOqpTOFVAPDkbjsureYwEGteTnWVc_DFuXTGgq6C1388jmjemNaPeiwg1ugTATlKI52rl86s4AISKAzOacvDVg,Tyooo,https://play-lh.googleusercontent.com/a-/AOh14Gjumod2GgU23JIzke98nR4s7p4g_VEGWSrBt4dD,"Dengan aplikasi reksa dana ini kita bisa dengan mudah berinvestasi. kalian bisa mencoba memasukan kode referal berikut : "" pemudakayaraya "" selamat bergabung",5,27,3.10.1,2021-05-26 06:48:57,,
36,gp:AOqpTOFmj-To7-rc_HEyIqiI0X14iDgZpntdsOVvKuGcr2PEgUKu0CNq0BH3w4sfXXuG7wMsFSYDRJwA8-gtQA,citra pribadi sembiring,https://play-lh.googleusercontent.com/a-/AOh14Gg1Z8Et-RntYtiZ4rK4_2BoFtM24eRHGAEo5BGCTw,"Aplikasi bagus verivikasi cepat, masih tahp percobaan semoga sesuai , Setelah puas dengan harga jual nnti di kasih bintnag 5 ,thanks",3,0,3.10.1,2021-06-03 05:02:49,,
37,gp:AOqpTOHYxN04MXarR8mKjCAJCaHcwqPokKT98I372aLLHKoT82OXtdoEIl2_wUh1nOoSCu6cjYtsOnHEjSq4Lw,Andira Permata,https://play-lh.googleusercontent.com/a-/AOh14Ghc75RCDssSXYsms7gHU_UqCpi-_jLP5nGwheHBtBQ,"Cocok banget untuk pemula, selamat mencoba. Guysss yg baru download bisa banget pake kode referral BIBITDIRA , buat dapetin cashback 25rb.",5,63,3.10.1,2021-06-02 14:59:27,,
38,gp:AOqpTOF34zj622SyfZDg6lDxZMMSIhUeqQlnh0rFA-8Q2EEAyXtPBf4K4v-dqxpyPzzVp7z9Q00uNm8tb5eoVw,Martin Pardede,https://play-lh.googleusercontent.com/a/AATXAJyf2-dhIf311XXLkPHBXTwsLGkE7Qp7P11FcYJN=mo,"Sejauh ini masih berjalan baik untuk proses top up, cashback gopay, switching, dan menjual sahamnya",5,0,3.10.1,2021-06-08 06:44:16,,
39,gp:AOqpTOFnGrLLzHc1gLz6wvtCREvwTXvT5u1WzZ7icZxMZehmAQtPQYL2Qz_WCdpi0VKKv7yzHaZwBMrfjG6x2A,Asnan Wahyudi,https://play-lh.googleusercontent.com/a/AATXAJztw_XRe9vdH2bFJqq-WNH_obsICDv1tj9BWkJl=mo,"Cukup mudah dipahami sebagai pemula seperti saya, tapi mohon dikasih pilihan pembayaran via DANA dong admin atau tidak SHOPEEPAY juga boleh. Di tempat saya top up gopay/link aja susah, gak semua punya ATM dan bertahan hidup di tempat elite. Mohon di kasih ya dan pertimbangkan!. Kali ini 3½ star dulu!",3,77,3.8.0,2021-05-13 04:53:44,,
40,gp:AOqpTOG_qqA5pLQ2TnuOGq8sLpV6Wv_Os91b2HEJJ5xmMmJEnsPCak19SvKTccLPFHSoviCqI0IpmYhGTYGnYg,Dimas Nugraha,https://play-lh.googleusercontent.com/a-/AOh14Gh--dR4T2Jo9gRiLUEqCeqnHj46STPvlBkF0tiYkg,"Tlong min, knapa saya kok gak bisa transaksi pakai gopay ya. Stiap kali klik pmbyaran pakai gopay gak mau muncul. Atas bbtuanny trima kasih",3,2,3.10.1,2021-05-27 18:45:06,,
41,gp:AOqpTOFfZGSRdfqocMkI_axyvjbyM_NDIlJWVy8y0kYa7BStPN9qW8wST3eoFP6ZCKX7tFPntKAZJAMjXezFAw,ahmad firdaus,https://play-lh.googleusercontent.com/a-/AOh14GgXWFQY-81rtVR-hq9IuGRzJxsRVsOM0LpVKXb6iw,"Hallo mimin. Apakah apk bibit sedang dalam maintenance apk bibit saya tampilannya jadi amburadul gini, tolong konfirmasi .trmksh",5,0,3.10.1,2021-06-04 01:29:02,,
42,gp:AOqpTOE_d8UOvkfUQwPirDW5zFmDFmNsZkrhO_F14vzCBRXmPacD3m3fiu2egMZfqn_LnpImUpFnYncQwEvc5w,m.khabir channel,https://play-lh.googleusercontent.com/a-/AOh14GhyFFe4901r9jnlfdi6mhNyB7QV5fn5p3op0aGgvQ,"Bibit memang bagus, cocok buat impestasi apalagi buat pemula, kita bisa nabung lalu dapat untung.",5,0,3.10.1,2021-06-08 04:12:12,,
43,gp:AOqpTOEFWUP4MIEnfj3GbftdRBJk0QM23T9_ZgMGte8qAjRYzW--RlYtFZWNhmk4uDR1Ou6rOXu_jkq7tuaVDw,akbar chasa,https://play-lh.googleusercontent.com/a-/AOh14GimtMFd_iBb1HB-tDZF9w4COem16-txufgjsy9a,"Aplikasi yang sangat recomended kuy nabung aja disini pakai kode referal ""akbarcuan"" dapet 25 rb!!!",5,0,3.10.1,2021-05-30 05:07:02,,
44,gp:AOqpTOHezx1sJio7QW6CUg6fMA7goroQPl70vVuUwoDaytr96uvDJPTp4BjM_4WCdwfu4s6bUQH3hb2O9bgdHw,Keluarga Zakky channel,https://play-lh.googleusercontent.com/a-/AOh14GhcXAWPPmafH2W9uUigFF4xvBbRIuN61SZ9M239dXo,Cara jual gimana ya. Saya baru masukkan. Masih belajar dulu. Giliran saya klik jual tanda merah jualnya gak merah jadi gak bisa di klik. Gimana mau nyoba,1,42,3.10.1,2021-05-22 09:45:53,"Hai kak Zakky, mohon ditunggu sampai tombol jualnya aktif ya. Kebijakan dari Bibit kakak baru bisa jual reksa dana 1 hari kerja setelah tanggal pembelian berhasil atau setelah mendapat update return sekitar pukul 17.00-22.00 WIB dan butuh waktu pencairan maks 7 hari kerja. Jika ada pertanyaan hubungi live chat Bibit/WA +622150864230. Terimakasih",2021-05-24 04:09:20
45,gp:AOqpTOF6NLRMQNG1SKf8JjvzNMBGZg2A7mQGlKBBA9O0y88nYF7CvIHl8xIo_AxR3qrIPNC6Olka9IUbU8mUMw,Fadli firmansyah,https://play-lh.googleusercontent.com/a-/AOh14GiQWctSYbaRg1VDsoPcasbINm9evwxh9lP5b6157_Y,baru nyoba nih saya invest di usia 24th semoga bisa jangka panjang. dan semoga bibit memberikan harapan buat masa depan saya 🙏,5,0,3.10.1,2021-06-01 18:53:39,,
46,gp:AOqpTOFHw0iMy1Oa3L39SnhsbHcImQqG_XEyBuG6NyQLGIL4xdiz1Y4eXtAqEHMp4djj77oOyzHAG0F6o6ADfQ,Rio Suk,https://play-lh.googleusercontent.com/a-/AOh14Gjxqo996PiIIC9z7am60FbWqcT2TltCwErfZM0Dhg,Sering ada kendala saat membuka apk dengan keterangan (ada sekrup yang lepas) Tolong diperbaiki lagi. Agar pengguna bisa dengan konsisten memantau apk ini. Terima kasih.,4,2,3.10.1,2021-06-03 14:30:15,,
47,gp:AOqpTOEx2dIQgdc2w6x8HsYFinHixFVdhTyfWPoruwCKOi3wMiqFVxUDlPsc_x-XZrHL8fsoyiJR5nREt_PeKg,Muhammad Robith Farkhan,https://play-lh.googleusercontent.com/a-/AOh14GgyJju6rW5ltXPcLWEiZyXbwR0P0SPmMoyQPtFR,"Hi, Investor! Investasi reksadana yang simpel, mudah, dan serba gratis ini itu tanpa komisi sepeserpun. Yuk cobain deh para investor pasar modal Indonesia. Legalitas bisa dicek secara saksama. Semoga Bibit terus selalu amanah dan memperbaiki ini dan itu sehingga investor pasar modal Indonesia terus meningkat jumlahnya.",5,54,3.10.1,2021-05-25 15:11:23,,
48,gp:AOqpTOHNgyTVo00iJXIbWjHYFZBhxx4Adm9xhEWzdivJ8A1FLiE7tcOiLVkDZKVHQ6P8LmXXs_lCUCZFAGyYDw,Ngang Ding,https://play-lh.googleusercontent.com/a/AATXAJypjvxQiN_z51o3Jo3koZqpWTkbuhzFSQhEyyzz=mo,"Tidak ada kata penyesalan berinvestasi di bibit ini,karena sdh jelas pengawasan nya(OJK) ,bukan kah begitu kak?",5,1,3.10.1,2021-05-28 22:51:43,,
49,gp:AOqpTOFF7C2Q-nwISLRg3rIZeb9NNq9wm5o9cKlQbVSp3qIwVQYX3MjSx1eH6IAsgJT46_mpPFOHWno-BC8ldA,Jagoan Tampan,https://play-lh.googleusercontent.com/a-/AOh14GhM4ri-zklgptLYN-9io1BWILDnCCQlHPNSoxN8cg,"Alahamdullillah Suka Banget nih ama aplikasi satu ini. Karena Fitur yang buat W menarik itu ada Preferensi Syariah, jadi safety banget buat kamu saudara yang muslim agar terhindar dari Riba. Nah Kalau Penasaran Download aja deh. Terus jangan Lupa masukin kode (elpoedjangga) lumayan cashback 25k, kalau kamu langsung top up. Dan untuk developer terus upgrade fitur-fitur unggulan dari Aplikasi Bibit. Syukron",5,32,3.10.1,2021-05-25 11:28:05,,
