,reviewId,userName,userImage,content,score,thumbsUpCount,reviewCreatedVersion,at,replyContent,repliedAt
442,gp:AOqpTOFo3j_argse0aXyqEblTaGhIkUfuE4A6ldT9ZChTmHS7_DedBHDrnK0YD7xenHMfL2e8lBQpgDJDaFKSQ,Anggie Warma Hartoko,https://play-lh.googleusercontent.com/a/AATXAJw8k8MAw_TWIggYPZgBzALzaanH3-A3qqvf0yao=mo,"Trimksih bibit, sudah kenalin SMA investasi.",5,0,3.10.1,2021-06-03 20:32:49,,
443,gp:AOqpTOGr28P9YiNRbruszxrQbwgniTmmRIDsWGFyNk7myg8sQUCC599kSbmDM53Vl695Ig44mdnROB5FCc7l8Q,AaKholiil 212,https://play-lh.googleusercontent.com/a-/AOh14GiKXT-zepXZ64BKUaG3UOG6YqAJpTLnGyMFv5XP1w,gabung hari jum'at hari selasa ini belum ada update keuntungan... Gimana ini admin... jgn bikin kecewa yg sudah percaya,2,4,3.8.0,2021-04-06 06:40:29,"Hai kak, return (keuntungan/kerugian) investasi reksadana dan unit reksadana akan masuk ke portofolio kakak 1 hari setelah tanggal status pembelian berhasil. Return diupdate setiap hari kerja sekitar jam 22.00 WIB, weekend dan Libur Nasional bukan hari kerja ya. Info lebih lanjut silahkan hubungi live chat Bibit/via WA di +622150864230. Terimakasih",2021-04-08 02:03:04
444,gp:AOqpTOHnA7lyFtr3lvVqauFw_z4djbCTwGww31XFAWYqVG5VtMqLPE5lWsIxxWWeg2g-zLeGPfvuIspgE0ntHg,M1 Donkey,https://play-lh.googleusercontent.com/a/AATXAJwD6xf-ITqyolQJSo66lS7hRssiWQZDNYifWov-=mo,"Buruan kalau kalian sudah download segera isi di atas ya, supaya dapat cashback 25rb dari saya,, yang bisa kalian investasikan atau kalian tarik lagi... lumayan kan bisa dapat bonus dari saya!!!!!!!!!!!!!!!!!!!!!!!!!! !!!!!!!!!!!!!!!!!!!!!! !!!!!!!!!!!!!!!!!!!!!!!!!!!!///////////////////////// /////////////////////////////////!!!!!!!!!!!!!!!!!!!!!!!!!!!!!!!!!!!!!! !!!!!!!!!!!!!!!!!!!!!!!!!!!!!!!!!!!!! !!!!!!!!!!!!!!!!!!!BIBIT sudah terdaftar dan diawasi oleh OJK.!!!",4,1,3.8.0,2021-04-12 00:16:24,,
445,gp:AOqpTOGlisI-pSiq7pIocJarQwgwniDjSIl38zFrAhJMXy60BOmwTY81vrELOZrD2cU5uFBmSJiPp9E1nitIfw,Satrio Bagus Putra Nurzaen,https://play-lh.googleusercontent.com/a/AATXAJwZBN6BVhLRALhAREZvDIRB91y3XknoUY_Whviv=mo,"kalo uangnya udah di wd, baru bintang 5",4,0,3.10.1,2021-06-02 14:34:01,,
446,gp:AOqpTOHmJItUs9l7frqRaq4ePIf16L3gRDzfjuaJt5WdWh4CdAuEC8g6y5tO_GfOH9f6HVAcMNd-xU953JAasA,Sastra Moge,https://play-lh.googleusercontent.com/a-/AOh14GgoLH00wVGDRuNALEbr2exvlyaZbuBF1zml5WKO6Q,"Karena apk nya mau di buka cuma mentok di logo nya aja tolong dong min solusi nya, nanti kalo bisa di buka dan bagus saya kasih bintang 5 .. janji",1,3,3.8.0,2021-04-07 18:56:50,"Hai kak, silahkan kakak coba untuk force close & clear cache terlebih dahulu, lalu silahkan kakak buka aplikasi Bibit nya kembali ya. Jika masih terkendala kaka bisa menghubungi layanan live chat Bibit atau via WA di nomor +622150864230. Terimakasih",2021-04-08 01:25:10
447,gp:AOqpTOHYkLdAqIzBhf_t86uVDBFx2i_mU-HsE42ik8A5-GmKveSrSSOTJOQiH1DrPPSQtgYwgYINcxsyGAxEfg,Gendys Putri,https://play-lh.googleusercontent.com/a-/AOh14GgS3vZ1mAngsLS61b5XVhQRtFuIjFvOjKC1Za0c,Download aplikasinya dan dapatkan cashback 25.000 dengan memasukkan kode referal ( kontrol ) #tidak pake kurung :),5,0,3.8.0,2021-04-10 07:18:14,,
448,gp:AOqpTOGElEl5LWKTp9NXmS-PIDycLNMSXrv76J7fG-PKwNmJb1A8GWGGa_ah7scB7gIWdc-smzYaCqnlDBFRRw,Ncek Dinasty,https://play-lh.googleusercontent.com/a-/AOh14GgHBUEKxfvqoEA9NBINQf1gPEomHoyBWBqlMzZhPA,semoga semakin berkembang kaya soda kue,5,0,3.10.0,2021-05-14 14:59:30,,
449,gp:AOqpTOEIGOv7OWCim_YZMXwU9BZ0PvCsY_KkeURGtDJpn0rFgluOc8x-ek4Z6SJ1CNvzhFgXBWzblPrxKvFWhw,Azzahra Agrilia,https://play-lh.googleusercontent.com/a/AATXAJzH0bSgOiKst8u9CO8RdTcxiesJi3v76u2pDgOo=mo,aplikasi yg sangat membantu untuk pemula. mudah digunakan walau baru pertama kali coba investasi.,5,0,3.8.0,2021-06-03 09:34:46,,
450,gp:AOqpTOHHorJxvloM1Gbr-DpNCKz2sfJO2lL2VEYd0RlEIIZVGbqPCngXMsKdPoatF_ujy4eeiRn9E7lhe3UIEw,Yuni Hastuti,https://play-lh.googleusercontent.com/a/AATXAJzc5Lzl9lDeXdBDXc4Ld8kNZm0juBElCKIzgxNX=mo,"Kenapa saya mau registrasi pas mau foto ktp selalu keluar dari aplikasi??,,,mohon bantuannya",2,0,3.8.0,2021-04-11 16:28:29,"Hai kak, silahkan kakak coba untuk force close & clear cache terlebih dahulu, lalu silahkan kakak buka aplikasi Bibit nya kembali ya. Jika masih terkendala silahkan hubungi layanan live chat Bibit atau via WA di nomor +622150864230. Terimakasih",2021-04-12 09:47:49
451,gp:AOqpTOGqrqFvtsNaYsnUK5lR2_Ef_HRTAtuahPTz9MpFxALZ6aqGZ4Wary5X5-P4fVPX1jsgJP2FgbNUs3hFCQ,MSP2 ABURAN,https://play-lh.googleusercontent.com/a-/AOh14GhfUqnGTvkjMEKKKNCfQQHckzPz-buWVA0YB62gdg,"Mantap banget untuk investasi, khusus nya untuk anak muda milenial masukkan kode referral [ sariyet ]",5,0,3.8.0,2021-04-10 03:29:17,,
452,gp:AOqpTOGpCbOm3KC5LTbcxOyZnc0NPUL0Zrf_AamXlISmocKzrvQ_1Yi-hvmW4-hejFIsgNgo7sn5jBNI6Bw4oA,Muhammad Dhafa Rinaldi,https://play-lh.googleusercontent.com/a/AATXAJxVwohNbq7fz__TumN92hsr78ccwMHHPVxB4S74=mo,"Udh di tutup paksa + hapus cache masih aja sering gagal koneksi , gimana si tolong di betulkan dong",1,0,3.8.0,2021-05-17 04:45:49,"Hai kak, jika sudah coba untuk force close & clear cache namun masih terkendala, silahkan cek pada Play Store kakak. Jika aplikasi Bibit sudah tersedia versi terbaru, silahkan diupdate terlebih dahulu ya kak. Info lebih lanjut silahkan hubungi layanan live chat Bibit atau WA di nomor +622150864230. Terimakasih",2021-05-18 02:19:14
453,gp:AOqpTOH1ms8MVH1T0J3r2rV7jnylv4frYJ2_LcUQnl_VV-DHdTcjiLupfTFbbUN4jwJyfEuC_N8F0A1_MN1DHA,Catur Bakhtiar Pramono,https://play-lh.googleusercontent.com/a-/AOh14Gi723l8W3VYsq92FR8KbqWYKA4pD5Nvt6JQYMH96A,"Saya merekomendasikan untuk para pemula yaang ingin praktek langsung dalam transaksi pasar uang, obligasi dan saham.",5,0,3.7.1,2021-03-30 01:40:26,,
454,gp:AOqpTOHKxs5-Sh6pYAYFWy0jWtqpnn0YboaS1pDLOmitiMALNE0dNHU17sN99BSpA0KXFzcFmeoJC0JpoMpDzw,Muhammad Fauzan Azhima,https://play-lh.googleusercontent.com/a-/AOh14GgBO2OF7P5uX05K6IcrTLrXGkw53OHksZXUHVrE,"Pencairan dana lama bangett, ga rekomen",1,0,3.10.0,2021-05-15 06:28:46,"Hai kak, pencairan dana dikirim Bank Kustodian ke rekening kakak yg terdaftar di Bibit sesuai ketentuan OJK maks 3 hari kerja utk RD Pasar Uang & maks 7 hari kerja utk RD Saham & Obligasi. 2-16 Mei bursa libur tdk ada penyelesain transaksi dan baru diproses kembali 17 Mei 2021. Info lebih lanjut hubungi live chat Bibit/WA +622150864230. Terimakasih",2021-05-17 09:59:05
455,gp:AOqpTOHH0UXox-gVHMp9dn_JkefohwTUTeJTqbgatGHlNvVFLq6ziMaXMJ-cG_bI5YfJI43jcaXrAr8BNVhUCg,deris Harianto,https://play-lh.googleusercontent.com/a/AATXAJzJCmjwdILUmX2mk4KByeq7vl9VAPLJBwR0vxIy=mo,"Subuh mudah,dan sangat membantu alhamdulillah saya sudah dapet ilmu dari sini,dan menguntungkan cocok buat pemula",4,0,3.8.0,2021-04-23 14:13:37,,
456,gp:AOqpTOHLM5L5lNXNEJnUBftUdX6UN_15FDFoXBvSFA_aZ62SZyHzXCeHWQ0PNE0qcRiF3M6W92O3P-rkxWN51A,Firdan Firdaus,https://play-lh.googleusercontent.com/a-/AOh14Gi45qMaepKDVfGMfZiQm4GXe0Z8kW8GMTT70Da3,"Sangat bagus, hadirin fitur darkmode dong, biar enak diliat nya. Keseluruhan udah sempura, tinggal tambahin tampilan darkmode aja",5,2,3.8.0,2021-04-18 10:41:40,,
457,gp:AOqpTOEKdmnmeeRrnxOs_bYgIJ8pLglorImFE3C5Vh4T1ViLVeIu_7rPUQ-0nuhbfV86cxcpRcubX2Hf8q1qQg,Sodik Abdul Rohman,https://play-lh.googleusercontent.com/a-/AOh14GgcWkDyEl96E5f0-ts8lNV1qlAgPmDrK814b1jC,bintangny 5 langsung Bibit memang APK invest yg terbaik...,5,0,3.10.1,2021-05-25 00:27:33,,
458,gp:AOqpTOG4yQJfhiFS4l_oNWpjbnoJE5kzjXdH3Ufous44UV4CwB1wDBogtn47r50evbTxkSKQFw9N293aFk14yg,Novia lestari,https://play-lh.googleusercontent.com/a-/AOh14GhQVxqEr94b9Tsom238bSpN0OvDQnaJkbsyxz_N,Bibit aplikasih terbaik.. Buat investor pemula harus coba pakai bibit.. Klau gak ngerti tinggal minta bantu robot aja heheh.. Sukses terus bibit❤,5,0,3.8.0,2021-04-16 18:02:54,,
459,gp:AOqpTOEXYVHVY5zqi5hXdOlrCLqzZukGp6KdV0uE8W2USDW5H3q7sO28dkisJSAVJ7sbx4hGntoHR7_QWueX4g,Muhammad Raihan,https://play-lh.googleusercontent.com/a/AATXAJwGwYxqK2wejf15FtVXBL2cgxXBvuQ_B5ViMAjt=mo,Pembayaran hanya lewat gopay dan link aja? Blm lengkap kah atau emg hanya 2 saja? Lewat OVO gk bisa kah?,4,1,3.7.1,2021-03-28 11:59:34,,
460,gp:AOqpTOEc7VoDFDMeKH3AS-GK7rXUbU460enuvoBdclnrKj8rtuB4BklxgaqV9AKY_gmvvQ8V8l2jeQim8ZbAcw,Radith Adiyasa Prayogi,https://play-lh.googleusercontent.com/a-/AOh14Gian_VLJXmyIFg1zK9D3o2xBQd8ZP6bMfxfiT5H,"Sejauh ini bagus, bahkan saya jadi makin rutin nabung di apk bibit. Mudah dipahami dan enak penggunaannya. Semangat terus ya developer 😁",5,1,3.8.0,2021-04-14 14:32:35,,
461,gp:AOqpTOHVhpe5RT2c-vOBwpU6XPbQaUGoAisrh_w6qMHeON0TQE5suS-yUcgC2-mCcPIQ1iWEM1oJ4uCxdigPjw,Libra Anggoro,https://play-lh.googleusercontent.com/a-/AOh14GhVe6fcSN79WnZtgptzIktll9lgh5hRektduWs_Xw,Ayo gunakan bibit untuk berinvestasi...,5,0,3.10.1,2021-06-01 06:58:04,,
462,gp:AOqpTOGtFdZTe1CbfF2WgMlbshbOxWjHw83jocA8xMlXp_vlp8U-hKDSIRR96MhV0hmSRhcUOrcJEcXFbWqeqw,Singgih Prasetyo,https://play-lh.googleusercontent.com/a/AATXAJwGPbSod80YVcsmo59RFaypih5kQBlK4V_-63Dv=mo,sangat membantu menjamin masa tua saya,5,0,3.10.1,2021-05-25 14:05:47,,
463,gp:AOqpTOH_Ui6lSKJCVBBkGAUOS1M_tWhl4A5t1qtoxyLiNLChBG3YTK-Q7Op41rqygnRrUNhMXYza1X7BYH3aYg,AnGGa PyU,https://play-lh.googleusercontent.com/a-/AOh14GilcyN-xx48nM0-kYZu05c1YMYiRcRgsGxq-CEA,"Awal ny coba2, trus coba jual saham tp proses nya lama banget harus nunggu 1 minggu sampai duit di transfer .👎👎👎👎",2,0,3.7.1,2021-04-21 16:12:54,"Hai kak, seluruh transaksi di Pasar Modal harus mengikuti regulasi dari OJK ya, termasuk Bibit. Batas waktu pencairan dana Reksadana ke rekening nasabah yg dikirim oleh Bank Kustodian maks 3 hari kerja utk RD Pasar Uang dan maks 7 hari kerja utk RD Saham & Obligasi. Info lebih lanjut silahkan hubungi live chat Bibit/WA +622150864230. Terimakasih",2021-04-22 02:55:16
464,gp:AOqpTOE-zZ6LydD6S8rserKh4c5jI5shzwkh8Fj6B9jQKjHT4PyWxjcmCkz4sgbwMsgBeJd6KXKz4q7se_-UUw,asep sukmana,https://play-lh.googleusercontent.com/a-/AOh14Gjpx9na2yqT3P1_fR9KUwsWirBYgU16DZmK8FNdvw,"Mau beli proses nya laammmmmaaaaaa, mau jual juga laaammmmaaaaaa.... Hellloooowwww Zaman sekarang masih doyan yg lemot2....?? Mending CryptoCurrency... Serba gesiittt.. payah",1,9,3.8.0,2021-04-13 22:55:54,"Hai Asep, pembelian dan penjualan reksadana tidak realtime ya, karena ada proses verifikasi dari Manajer Investasi jadi prosesnya lebih lama dengan batas waktu maksimal 2 hari kerja. Info lebih lanjut bisa hubungi live chat Bibit/WA +622150864230. Terimakasih",2021-04-15 02:19:07
465,gp:AOqpTOHat7gL7Uib411MMFR7b3j7aMf5O7O4JU7k9CxJtBhhSuQj9nkR3MaVP7cIS5nB-vNnOys1yBKKVFkXkA,Ayu Fitria,https://play-lh.googleusercontent.com/a-/AOh14GiVFIjpOiw9iWGNVfZ48QgahAHRIhaHMQQ3Zy7X5w,DAPATKAN 25.000 dengan memasukkan kode referal : ayufitria,5,0,3.10.0,2021-05-16 07:33:00,,
466,gp:AOqpTOGUCT7IRU11MRfEWHoApG5cqcznnB-XNRaoalrdzsdnuEDR89BQs5_-aV3FPdBpSl8HXUVXghN0AhdjKQ,Delly Delz,https://play-lh.googleusercontent.com/a-/AOh14Gip8hB9mUxHZAheXNU6wMazDuqfRBa0CYBg--In,Aplikasi bapuk.. orang main saham nambah... ini justru malah ngurang terus tiap hari... makin parah lagi .. gak ada naik2 nya.,1,3,3.8.0,2021-04-21 06:06:31,"Hai Delly, return didapat dari selisih NAB yg dpt berubah mengikuti keadaan ekonomi, suku bunga & kinerja Manajer Investasi. Baiknya tetap rutin investasi utk mendapat harga rata2 terbaik di berbagai kondisi pasar agar saat pasar sdg turun akan terhindar dari kerugian yg besar. Info lebih lanjut hubungi live chat Bibit/WA +622150864230. Terimakasih",2021-04-22 02:26:23
467,gp:AOqpTOEGzusNw2UjhcYgkg1HT6ZOf2ILUmTZj5nV6Q95zVebHtaNDfT7NO77z7kBVU_lqKDUQmwZWcqhrj6x5g,VIEW LIMITS TIME,https://play-lh.googleusercontent.com/a-/AOh14Gjw_TM0-T51f80UOASObFyWuRZv5wEO4R7NI04Wvw,Tolong kenapa bibit ini sering sekali eror,2,0,3.10.1,2021-05-26 23:19:22,"Hai kak, untuk mencegah kendala kakak terjadi secara berulang, silahkan kakak coba untuk force close & clear cache terlebih dahulu, lalu buka aplikasi Bibit-nya kembali ya. Jika setelah ini masih tetap terkendala, harap langsung hubungi layanan live chat Bibit/WA di nomor +622150864230 agar tim kami bantu tangani lebih lanjut. Terimakasih",2021-05-28 02:36:16
468,gp:AOqpTOGtcqV90XucX5emzpd5ed27bSX4YvKFGfPkvo8P1qdXV2n1bV9Z0ZlUeS9VdqG4x3o1936OKJ3HMrNrKQ,armia Santika,https://play-lh.googleusercontent.com/a/AATXAJyDPUVXPqrn1v1zcKEb68lhD3LSn22EO_Y2gPAJ=mo,"Keren sih, dan sangat recomended buat pemula, saya sangat berharap ditambahkan lagi top up via DANA biar lebih mudah lagi proses top up nya. Makasih semoga segera di adakan.<!!!!!!!!!!!!!!!!!!!!!!!!!!!!!!!!!!!!!?????????????????!!!!!!!!!!!!!!!!!!!!!!!!!!!!!!!!!!!!!?????????????????!!!!!!!!!!!!!!!!!!!!!!!!!!!!!!!!!!!!!?????????????????!!!!!!!!!!!!!!!!!!!!!!!!!!!!!!!!!!!!!?????????????????!!!!!!!!!!!!!!!!!!!!!!!!!!!!!!!!!!!!!?????????????????!!!!!!!!!!!!!!!!!!!!!!!!!!!!!!!!!!!!!?????????????????!!",4,68,3.8.0,2021-05-02 18:33:38,,
469,gp:AOqpTOHKQCAJt6SiV0sqOjKlssQQexLKnJFcqK1Jo5lGBEie-8kmtxVauT6A4yx6ehXDn7hHatUreoEtO4-QAQ,Khoirul Azzam,https://play-lh.googleusercontent.com/a/AATXAJyfFZMDwRz3pEK-KdsCGRfGzwtr8z0fyz8rOLi8=mo,"Gak kamu apa apain, uangmu bertambah ... Segera Investasi mulai sekarang. Kode referal : bibitluluk utk mendapatkan lgsg saldo 25.000 Buktikan !",5,1,3.8.0,2021-04-09 18:21:28,,
470,gp:AOqpTOHz6GFV-GFjLAYtu1mKdZArGKqRssbjWUUUfY2WrKo3IvhfHwhy_OsuVbezEjKvYoCnzuqnv1q3B7LPGg,Hendri Suharto,https://play-lh.googleusercontent.com/a-/AOh14GhIEG55Y1wtOc1GaUseZJTFYOIaRwR9fEHSq29w,Gak ada menu jual nya di aplikasi saya,1,1,3.10.1,2021-05-27 01:28:12,"Hai kak Hendri, kebijakan dari Bibit kakak baru bisa jual reksa dana 1 hari kerja setelah tanggal pembelian berhasil sekitar pukul 17.00-22.00 WIB atau ketika sudah ada update untung/rugi. Pencairan dana membutuhkan waktu maksimal 7 hari kerja sampai masuk rekening kakak. Jika ada pertanyaan hubungi live chat Bibit/WA +622150864230. Terimakasih",2021-05-28 02:14:13
471,gp:AOqpTOHMUKtQx1Uikyt7PGEeGZNuvGRB91OjyR_1ECz7Uaft9ilNCqlyJcw2oFsaP1u9jJuwf7N4VfA9TZR6yQ,andri nofrinaldi,https://play-lh.googleusercontent.com/a-/AOh14GgL2a5CixkvRnu6ffO1Gb6TTHD8SB3DwfZMbOYnOQ,"dengan bibit membuat kita mudah mengatur keuangan, dan melihat persentase pertumbuhan investasi, membuat saya bersemangat untuk nabung investasi dibibit",5,3,3.7.1,2021-03-27 15:36:26,,
472,gp:AOqpTOG5P4YwWdOQ3DyIAMl-AiQhU2UaTyFzMXFz9q2REIsnqvyFdoQx9mtmb44Lgv1ZsQQc90Og99TvzP8XNg,Hachi Mitsu,https://play-lh.googleusercontent.com/a-/AOh14GiATQ3nqXC8avsPpR4QOX33cyLYEg56XBY8FTUGLQ,Mantaappp aplikasi terpercaya buat investasi. Lebih mantap pake kode refferal ini sutra Pakai kode tersebut kalian dapat bonus 25 ribu,5,0,3.8.0,2021-05-04 05:38:59,,
473,gp:AOqpTOF1QbPBgXFzkDSZL6sIQI3LQz4M-A4oHeu7loy6WlLW-cUKNLgTrzBLqCOGSZwxlpUtVvAVZY6xfCarFQ,Oman Rohman,https://play-lh.googleusercontent.com/a-/AOh14GhfyV6yJuvHzziC7lT7e4FLFtoJ92yoCrqzjVlRpg,"Mantap nih aplikasi, registrasi akun ada pilihan untuk upload filenya juga (E-KTP dan Foto Selfie Dengan E-KTP), jadi bagi yg Foto wajah di E-KTPnya sudah pudar juga tidak memiliki kendala (jika punya softcopy E-KTP waktu masih bagus), dan untuk verifikasi juga sangat cepat, kurang dari 1 jam doang akun sudah terverifikasi. Terima kasih.",5,1,3.8.0,2021-04-18 16:21:29,,
474,gp:AOqpTOH8nxcY6jvM0oe0D63dbnIjfa5CKEbWewv3fRGpi8N3bf2Urvrwc_i_TG1Bzl-aGe7o1ajwznjGRbnkmQ,BERATAAN 99,https://play-lh.googleusercontent.com/a-/AOh14Gh-YV9MC8e-H4W9Sk_pHy3ZXMD_cL8Zk6UVS90T,Saya habis jual saham.tetapi cuman setengah saja yang masuk di atm saya sisanya ga tau kemana.betul sih uang nya tidak seberapa tetapi bagi saya itu sangat berharga,1,8,3.8.0,2021-04-14 15:15:18,"Hai kak, pencairan reksadana sesuai denganNAB jual yg didapat & dana penjualan akan dikirim Bank Kustodian ke rekening kakak yg terdaftar di Bibit sesuai prosedur maks 3 hari kerja utk reksadana pasar uang dan maks 7 hari kerja utk reksadana saham & obligasi. Jika lebih dari itu bisa hubungi layanan live chat Bibit/via WA +622150864230. Terimakasih",2021-04-15 01:51:54
475,gp:AOqpTOHAmV1XZQsxF2-mgGFRZJVP51XdZG8JunEGzohCo0jUgSHkdjcBuzYnIn_LguHskCUDKMtfwfd87kdywg,Albiowinsobo Ajiseto,https://play-lh.googleusercontent.com/a/AATXAJxZKLfkLUcvv8_cmRLcLsNOaOm5dHCDNVXw0B9l=mo,"Susah banget mau registrasi keluar"" Mulu",1,0,3.10.1,2021-05-25 03:05:18,"Hai kak Aji, terkait kendalanya silahkan kakak coba untuk force close & clear cache terlebih dahulu ya, lalu kakak buka aplikasi Bibit nya kembali. Jika masih terkendala harap langsung menghubungi layanan live chat Bibit atau WA ke nomor +622150864230 agar dapat tim kami tangani lebih lanjut. Terimakasih",2021-05-27 09:22:03
476,gp:AOqpTOH5hR3JFcfb17HCNm-iOPlTFyqRx_BRn3zlofKqCuG8epkSE2z2BkTuEqMmrK1fd0k1RcBj50GTGJPy2g,Mina Rosiana,https://play-lh.googleusercontent.com/a-/AOh14GiPJGhFrs3Vj-uo9dUIgeF5fRKwri3fCKcDBxqY,"Isi ""25kinilho"" dikolom refferal yah biar dapet cashback 25000",5,1,3.10.1,2021-05-20 10:02:03,,
477,gp:AOqpTOE6cCHnILb4fxGEFhS2It6zLiHIYltUpmnev3xtm-6g55XgzcsL0NKH4DBgpNKwcRX0knDyRNPhzTYk9g,Arif,https://play-lh.googleusercontent.com/a-/AOh14Giuf4qzKDepEGeM_teop5TX9OEC7U1Y47A7_UbV8A,"Kecewa gua, udh investasi 300rb + dapet keuntungan 200rb pas gw jual udah ada tulisan penjualan berhasil tapi tiba2 gw logout sendiri + malah registrasi ulang, keren nih aplikasi tipu2nya",1,11,3.8.0,2021-04-07 00:48:13,"Hai kak, silahkan kakak coba untuk force close & clear cache terlebih dahulu, lalu silahkan kakak buka aplikasi Bibit nya kembali ya. Jika masih terkendala kaka bisa menghubungi layanan live chat Bibit atau via WA di nomor +622150864230. Terimakasih",2021-04-08 01:46:48
478,gp:AOqpTOFIKZWbTLupht8xy3UNtbZIQHe7fEZjSWwMKEzXBS0k_vWbJX3WvGyyxK2h_6BxZqZipIxmLBiFdsyaUw,Aan Deswanda,https://play-lh.googleusercontent.com/a-/AOh14GibbtBlHMswqpv98IwLITpgLAfmk41b_Z07Cwp8VQ,Jangan lupa Kode undangan : wajahmilineal,5,0,3.10.1,2021-06-02 19:16:53,,
479,gp:AOqpTOH-XRKNeeunfu60T1tseh2pE_IObv8lIzSALoDOIml-k_hnLiwMIFfrPsU2YxbTnE2WsPiwLT2BMEsEGg,Arhpie Peandetau,https://play-lh.googleusercontent.com/a/AATXAJyEM4PhZHGrxwMHQer3V586oMgiTM-9ISEPu3EJ=mo,"saya mau tanya ni,, penarikan saldo di bibit apakah bisa dilakukan setiap saat atau ada jangka waktu yg ditentukan! tolong penjelasannya",5,4,3.7.1,2021-03-28 12:48:21,,
480,gp:AOqpTOHbk4Z7QsToLWbQTSr507U035nB8yQH4SN3yJIUMolPPl-JaPaF6k6I_5ilfqVt17kLQWX3YKekABqVYw,Frederik Michael Kristian,https://play-lh.googleusercontent.com/a/AATXAJzGJ5yNDdGmjsbRHvS6uBtk49WczaUQEO10Aget=mo,"Kecewa dengan pelayanan yg lama, menunggu pencairan membutuhkan waktu seminggu lebih. Katanya pencairan cepet..",1,6,3.8.0,2021-04-09 08:30:47,"Hai Frederik, pencairan reksadana dikirim Bank Kustodian ke rekening kakak yg terdaftar di Bibit sesuai ketentuan OJK max 3 hari kerja utk RD pasar uang dan max 7 hari kerja utk RD saham & obligasi. Weekend & libur nasional tidak termasuk hari kerja. Jika lebih dari itu bisa hubungi layanan live chat di aplikasi Bibit/WA +622150864230. Terimakasih",2021-04-09 09:56:27
481,gp:AOqpTOHu_V7uT4n_mfYR6EzqSifukJAF_VXZHQdKh-fx1RlO0v8_4Fwq3vx98tsQUoAnk4-kcV-Ue5eNiuYwfQ,NETINA VLOG,https://play-lh.googleusercontent.com/a-/AOh14Gjf-iv1Riqij4rz-PMrbRt-6Qu-KgodAEJoS0S6dw,"Kenapa akun saya sering log out sendiri? Harus log in dan log in terus, mohon jawabanya? Thanks",3,2,3.7.1,2021-04-05 14:47:37,,
482,gp:AOqpTOGa__G867HJ-OiVQM42F4be8yMWxWFxpiEQOrTqfzsQ0MjuI02mLK6TuEytBclN4bm0TGLvxubDaDmt9w,musimin sb12,https://play-lh.googleusercontent.com/a/AATXAJz9IPaYMlEIS6JQ4jy6uJpA-hAiYEdF9GnfRXVa=mo,"mari belajar investasi yang sangat mudah dan aman, buat masa yang akan mendatang, segera dwonload aplikasi bibit.<!!!!!!!!!!!!!!!!!!!!!!!!!!!!!!!!!!!!!!!!!!!!!!!!!!!!!!!!!!!!!!!!!!!!!!!!!!!!!!!!!!!!!!!!!!!!!!!!!!!!!!!!!!!!!!!!!!!!!!!!!!!!!!!!!!!!!!!!!!!!!!!!!!!!!!!!!!!!!!!!!!!!!!!!!!!!!!!!!!!!!!!!!!!!!!!!!!!!!!!!!!!!!!!!!!!!!!!!!!!!!!!!!!!!!!!!!!!!!!!!!!!!!!!!!!!!!!!!!!!!!!!!!!!!!!!!!!!!!!!!!!!!!!!!!!!!!!!!!!!!!!!!!!!!!!!!!!!!!!!!!!!!!!!!!!!!!!!!!!!!!!!!!!!!!!!!!!!!!!!!!!!!!!!!!!!!!!!!!!!!!!!!!",5,40,3.8.0,2021-05-07 16:50:58,,
483,gp:AOqpTOEhA2-lZPAEdzfSGLwjeUk6gp9BpuZXXyDAJO9nKOoSozEO-h-zpkcr-SeTecurJKakf8lj79uGlITVcw,Okky Diantoro,https://play-lh.googleusercontent.com/a-/AOh14GgdxXHXUgSz1mIFha1p9kxkkjSn8SyxreWqaOX9EQ,mudah mudah bermanfaat untuk investasi,5,0,3.10.1,2021-05-30 14:18:41,,
484,gp:AOqpTOGc681n8Mif9BllUDaEtLXn2_P3VdT3S0w2CM0OQQd52FYR0tzwx7GYnmgeEJhFtONhbZqVn6a7HOOI3g,Bpk susanto,https://play-lh.googleusercontent.com/a-/AOh14GiFab4lBAQXP7a0cbjqbvYwnzOwa3TS552Cb4x-4A,gunakan kode :(alisyafood) untuk dapat saldo 25 ribu.jangan lupa kunjungi toko kami di shopee:alisyafood official shop untuk dapat voucher belanja di toko kami..,5,1,3.8.0,2021-04-14 00:06:23,,
485,gp:AOqpTOFGPdGxAPs-o5EEnZL8JzahvzXL3fnLgNy530XE9j1B6MJyIYacNOaxrXljbZ8B859pzdOcHROzz5Ovtg,Sandal Jepit,https://play-lh.googleusercontent.com/a/AATXAJxiQiQGUABrFE-qNZ2EMS4MDRPrmjgeulhyCfg=mo,"aplikasi bibit sangat membantu, aplikai reksadana yang sangat mudah di mengerti buat pemula yuk yang mau belajar investasi segera dwonload aplikasi bibit, pastinya gak akan nyesel deh. aplikasi terbukti aman dan nyaman.<!!!!!!!!!!!!!!!!!!!!!!!!!!!!!!!!!!!!!!!!!!!!!!!!!!!!!!!!!!!!!!!!!!!!!!!!!!!!!!!!!!!!!!!!!!!!!!!!!!!!!!!!!!!!!!!!!!!!!!!!!!!!!!!!!!!!!!!!!!!!!!!!!!!!!!!!!!!!!!!!!!!!!!!!!!!!!!!!!!!!!!!!!!!!!!!!!!!!!!!!!!!!!!!!!!!!!!!!!!!!!!!!!!!!!!!!!!!!!!!!!!!!!!!!!!!!!!!!!!!!!!!!!!!!!!!!!!!!!!!",5,30,3.8.0,2021-05-08 18:34:54,,
486,gp:AOqpTOGHvzttkVRXTA48XrvlG-IZy_fcFJMtXG_lKYSpZuc5oB1NCAmvIW25Nudm1Mv_J5F7WW9FzXC-aNFGKQ,Riski RAmadani,https://play-lh.googleusercontent.com/a/AATXAJzCC7T47tCmvmHacEjBDf-7YRJOwGAJ2syMfOFX=mo,"Layanannya ramah,cepat tanggap.good",5,0,3.10.1,2021-05-27 02:26:34,,
487,gp:AOqpTOG5Q6hrsGmAcr1SypHlxDmO8jyBJaeM0av79KbDvapC7ZSYp8wNh_la5cB-KWJf1B9F578qknhD_oV09g,Juani Apui-NE5085-6C,https://play-lh.googleusercontent.com/a-/AOh14Gj_0iHZr1oGqAvOp2U92-kjAfShZ0ssv3JRDoAy,"akhirnya Nemu jg apl yg terpercaya aman bnget mudah lg dlam penggunaannya, mantap pokoknya",5,0,3.10.1,2021-06-08 01:09:03,,
488,gp:AOqpTOEyTUvZpI5oP8GmERssfj2YxP-aR07CoyNQzTe39ZcDXc_5Yl8A_0iSrhzvjzRt58LRDdpMUDSbyWfhPw,Dianna Priyanti,https://play-lh.googleusercontent.com/a-/AOh14GiMVBuHmz1ZZn9hm3v_yFRx2D4o-y7Kqsce3DaE,Saya kenapa tidak bisa melakukan pembayaran? Katanya akun sedang dalam proses pembuatan. Sampai kapan ya?,3,0,3.8.0,2021-05-02 04:14:54,,
489,gp:AOqpTOGPkk9ltrvdGvNy3WaZKCiEC4gAQdHcijtd2CorX8swRLaCD54h9QHBvGKRzJO8AfRUl8rL-yk-vpGSVw,Kode Referral : GENIO,https://play-lh.googleusercontent.com/a-/AOh14GiGBlqhhC6Nw1ILSk-0ia9EiaabCIkaWjCiwuVj,"aplikasi bibit sudah bagus menurut saya hanya saran min tambahin fitur tarik tunai ke gopay ya min, seperti aplikasi yang lain.<!!!!!!!!!!!!!!!!!!!!!!!!!!!!!!!!!!!!!!!!!!!!!!!!!!!!!!!!!!!!!!!!!!!!!!!!!!!!!!!!!!!!!!!!!!!!!!!!!!!!!!!!!!!!!!!!!!!!!!!!!!!!!!!!!!!!!!!!!!!!!!!!!!!!!!!!!!!!!!!!!!!!!!!!!!!!!!!!!!!!!!!!!!!!!!!!!!!!!!!!!!!!!!!!!!!!!!!!!!!!!!!!!!!!!!!!!!!!!!!!!!!!!!!!!!!!!!!!!!!!!!!!!!!!!!!!!!!!!!!!!!!!!!!!!!!!!!!!!!!!!!!!!!!!!!!!!!!!!!!!!!!!!!!!!!!!!!!!!!!!!!!!!!!!!!!!!!!!!!!!!!!!!!!!!!!",5,63,3.8.0,2021-05-04 18:37:14,,
490,gp:AOqpTOEabMnr9sUpzDlMGI0uv9x6keQBr-_dvBoTojO6xD0h4HdcCq-o0pAZREoEtZ7o_3sbLpsbTOa1WOfy0Q,ERI Sc. setyocahyono,https://play-lh.googleusercontent.com/a/AATXAJyHDSji5dr9YnFNsAt7NupDtNkBPkNA7DfrLUwR=mo,membantu sekali buat yang pengen nabung,5,0,3.10.1,2021-06-01 05:03:06,,
491,gp:AOqpTOHsUsPWG75DcWzdyyqyfk2Q2i_Dp3h4KlANwaQ3HIJL0RqOGlixVELaIHzaCvgLApIrIBHHAcHhitLVuQ,Bang Hamid,https://play-lh.googleusercontent.com/a-/AOh14GgFrTjwSzrzhyxI0Fl1BaJbf1wrPDsrlS3AxlgZ,Mantab nih bibit gampang gak ribet untuk pemula . Boleh untuk yg baru instal pake kode REFERAL saya : 3qjudhf . Dan grow up bersama salam cuan,5,3,3.8.0,2021-04-10 03:05:10,,
492,gp:AOqpTOHfvT5ZOOn_JSnAYcJv5ZJtX9K2qN8Cc9vOIyv9lMgwJJ4CUJovFcOu-pm2TVjZ8rJTqqhyTdbWsbAQAQ,Agil Fathiha,https://play-lh.googleusercontent.com/a-/AOh14Gg7pr4YOSo6zww2VcT3vzUUGchWitiw1u1BL-oo7g,Kenapa habis regristasi keluar lagi? Dan disuruh registrasi lagi padahal email semua udh terverifikasi,1,0,3.8.0,2021-05-10 10:03:56,"Hai Agil, silahkan login menggunakan nomor hp terdaftar di Bibit kemudian gunakan metode OTP misscall untuk verifikasi loginnya ya. Jika masih terkendala hubungi tim support kami pada layanan live chat atau WA di nomor +622150864230 untuk ditangani lebih lanjut. Terimakasih",2021-05-11 03:03:40
493,gp:AOqpTOGsgmBhHkPkHtm1sXA4xLrSAd5Ublr54llDo6OHOrzPbUDYHcuo7sWYQoFVxoSv-o19w8UGa-xssvDpqA,muhamad rifai,https://play-lh.googleusercontent.com/a-/AOh14Gj9QqGEXSyEeObIP5whkEuyYDc-v7mup8PX_riRYw,"Belum sebulan investasi, semoga ini cara terbaik untuk menabung dan mempersiapkan biaya kehidupan di masa depan",5,0,3.8.0,2021-04-23 18:40:46,,
494,gp:AOqpTOFUAmamjgFcl01yaM_md2FZYqQSUJ1cEsgQZ-eLePwi71LPqe_wZ_mCy1H6GQoo4X3O0xIlFsByf8YkhQ,Lita Ayuni,https://play-lh.googleusercontent.com/a-/AOh14GhJeSqnabRTJEKkwD7-xEjHFlzDD-CkOjT-6vS_,"Saya kasih 3dulu ya karena saya baru pemula.tapi setelah saya baca ulasan dari para yg sudah gabung, menurut saya hasil nya positif sih,yaaa...biar pun saya belum masukan dana/iven.tapi ada juga PR yang harus dilakukan dari pihak bibit mengenai pencairan, kalau bisa agak dipercepat.itu aja sih..!!!",3,0,3.7.1,2021-04-04 02:57:46,,
495,gp:AOqpTOERfzsZ-hltPtpiT_3Ko-EZoiyS350mos4ljgcnLoo2mjPEGNsuG-RN3cr9PsDOazcnRzl2yn8NGB2kow,idont know,https://play-lh.googleusercontent.com/a/AATXAJyXyVltDgDtWNOjUZNykzlLTWS437Drwjw_8j5M=mo,jkxoers Gunakan referal saya untuk mendapatkan potongan 25k untuk transaksi pertama anda di bibit,5,0,3.8.0,2021-05-10 23:46:18,,
496,gp:AOqpTOEuOccCwOnWNOv-gw-9iUAIwNTcJY3hA6vezzLMqGW98L-rfTxlC8Ed-EnMHRxhXlYgkmzR7jNme7tn0A,Akhmad Rizki Saputra,https://play-lh.googleusercontent.com/a-/AOh14Gg1ZGA3JerVh3rwQHhRufr-QlDPQS7ar_vxooPPrQ,"Top up lama, penarikan lebih lama -_-",1,0,3.10.1,2021-06-01 23:32:15,"Hai kak Ahmad, pembelian & penjualan reksadana tidak realtime ya, karena ada proses verifikasi dari Manajer Investasi dgn batas waktu maks 2 hari kerja. Utk pencairan dana sesuai ketentuan dari OJK akan dikirim ke rekening kakak oleh Bank Kustodian maks 7 hari kerja. Info lebih lanjut silahkan hubungi live chat Bibit/WA +622150864230. Terimakasih",2021-06-03 08:59:58
