,reviewId,userName,userImage,content,score,thumbsUpCount,reviewCreatedVersion,at,replyContent,repliedAt
679,gp:AOqpTOFiSakrLssQ8YJeOUtx3IPZIf0DvFJiE36ytr-8LzsCCSGLgmIlX-nl3y-Nh6o57WvVOc-vB7ykgV7Fjw,DBM Exhaust,https://play-lh.googleusercontent.com/a-/AOh14GhIR4__OGucUVvKXnyEyaXiw6f3ZZhW9r2o_CGAUw,"Masukan kode referal ""bissmillahbarokah"" saat mendaftar untuk klaim 25 ribu 🙏😉 bissmillah sukses barokh",5,0,3.8.0,2021-05-18 16:24:33,,
680,gp:AOqpTOGEBGwgENgzEtbPBgRikCnVWt1tf1UCwv7ZFG6e7MH06K86uiR2pVXST915a61ZQRzdnpLD-s4snA-Gqg,Muhamad Mberrr,https://play-lh.googleusercontent.com/a/AATXAJwmptwuhtQvwIiP61pTdBKhdfGFfSHfH6Om8tjZ=mo,"Kemaren saya nyoba inpes 100 dulu pas sekarang mau buka bibit akunnya malah hilang,tolong jelasin min",1,1,3.7.1,2021-03-27 05:32:42,"Hai kak, terkait hal tersebut kakak bisa login menggunakan nomor yang terdaftar di Bibit, lalu pilih kirim kode OTP melalui misscall, kemudian input 4 angka terakhir dari nomor misscall tersebut sebagai kode OTP kakak. Jika masih terkendala kaka bisa menghubungi layanan live chat Bibit atau via WA di nomor +622150864230. Terimakasih
",2021-03-28 14:36:30
681,gp:AOqpTOE4YoRuWXoLlaCWYB_9XwOL3MIOzKG1ck3BfeBK8Xf5eFg43vuFqUCWCNXmrl0V7_eVvPmlU5UaoXmWUQ,yunita06 anggraini,https://play-lh.googleusercontent.com/a-/AOh14Gh0xOt3_b8fbOLKUUtYBP5cYP4QKa7U85mwdJDuoA,"Hadeuuuh, pas top up cepet tp pas jual lama bgt masuk ke rekeningnya sampe 7 hari kerja... Yahhhhh😩",1,1,3.7.1,2021-04-05 05:38:31,"Hai kak Yunita, pencairan reksadana mengikuti NAB jual yang didapat akan dikirim Bank Kustodian ke rekening kakak yg terdaftar di Bibit sesuai prosedur maks 3 hari kerja utk reksadana pasar uang dan maks 7 hari kerja utk reksadana saham & obligasi. Jika lebih dari itu bisa hubungi layanan live chat di aplikasi Bibit/WA ke +622150864230. Terimakasih",2021-04-05 09:21:35
682,gp:AOqpTOHrFWnUksXSb5u8h4EFjVCIFJsOEQNLnEZw_8Yx55Udt4mRRxNJ5QQABC4bnBFMQKhAWaBN2SVgOgLzcg,januar nugraha,https://play-lh.googleusercontent.com/a/AATXAJxcQ8Ks8TIpiZTTa3RKEQYcKuuOUVBczQd163Zu=mo,Bagi yg baru download aplikasinya silahkan pakai kode referal : odadin9 Untuk mendapatkan cashback Rp 25.000,5,1,3.7.1,2021-03-28 16:07:58,,
683,gp:AOqpTOGNZAjqEpGUHZlim1IQ7x8foqcidVWrXU9EcrfHXZFSl_99wQObTQTTEMO-bWOVfiHqVlNVP0LA3yRicw,Akang Indra,https://play-lh.googleusercontent.com/a-/AOh14GgdpWUu6ND79VQwl1W-mWnr5slEMbCUsrxa8YZt2Q,Wah banyak yg ngeluh WD lama.... bahaya nih...yakin 7hari kerja cair???,2,0,3.8.0,2021-05-02 14:58:57,"Hai Indra, seluruh transaksi di Pasar Modal harus mengikuti regulasi dari OJK ya, termasuk Bibit. Batas waktu pencairan dana Reksadana ke rekening nasabah yg dikirim oleh Bank Kustodian maks 3 hari kerja utk RD Pasar Uang dan maks 7 hari kerja utk RD Saham & Obligasi. Info lebih lanjut silahkan hubungi live chat Bibit/WA +622150864230. Terimakasih",2021-05-03 05:46:45
684,gp:AOqpTOHwKMiiYtqzyrP55kTqZngInrJbVQ3D8eRAFopLXbJtaQp-B6pMvaMAXLRymmc6xh2QydpexoGoo0sBnQ,Muhammad Aryadira,https://play-lh.googleusercontent.com/a/AATXAJwsrpBSKaNiyDxO2-HKnAf8D2qYDaGgA48fvTI=mo,semoga bisa cuan invest disini,4,0,3.10.0,2021-05-27 15:49:43,,
685,gp:AOqpTOHahBAEfUUl3u3IvxrHHZqyaadcpEi-ZFvF5rpIKyY3AO-x9qR3hSvmYtQJgDn5pi__My7UYd7vKDwwzw,Rosit 30,https://play-lh.googleusercontent.com/a-/AOh14GjADo8Ojh6p_XeBVYdOCfkRLwg-KGrHfM7PrvhaMA,Butuh makan nya sekarang tapi malah tunggu 7 hari ya mati nggak makan,1,0,3.8.0,2021-05-27 05:33:00,"Hai kak, seluruh transaksi di Pasar Modal harus mengikuti regulasi dari OJK, termasuk Bibit. Batas waktu pencairan dana dikirim Bank Kustodian max 3 hari kerja utk RD Pasar Uang & max 7 hari kerja utk RD Saham & Obligasi. Investasi baiknya tdk memakai uang utk kebutuhan pokok ya kak, info lebih lanjut hubungi live chat Bibit/WA +622150864230. Trims",2021-05-28 02:31:00
686,gp:AOqpTOFrNJPqGhXDKc6lf4hkXQIE49jBLZAMwMIeovVychh_zxMWi2PBxqapYPSeQlAFomN2A5JT1glnfnnXAg,palupi ngeces,https://play-lh.googleusercontent.com/a/AATXAJwa1Cg9zYBsg3lKoYmIW0UgCJqZnnbaLqAtSkNc=mo,gud saya suka tampilan nya,5,0,3.10.1,2021-05-29 06:50:39,,
687,gp:AOqpTOH2B5s9QZNOJgv6VToKzCNbSilZMv8pBk-WYvYLhyTxo7ax4A0r8FwPBGeKt7IBrMzWqbW8j1whwKwcgg,Immanuel Yadika Sukandar Silaen,https://play-lh.googleusercontent.com/a-/AOh14Gg8mQSnmktm7aFYSE9npRsHvBkHHpOOAn1MJegtBA,Mengapa saya tidak bisa melakukan pendaftaran ke Bibit karena layarnya ketutupan?,1,0,3.8.0,2021-04-11 01:12:03,"Hai Immanuel, terkait kendalanya silahkan langsung hubungi tim support lewat aplikasi Bibit atau melalui WA di nomor +622150864230 agar dapat langsung dibantu masalahnya. Terimakasih",2021-04-12 09:11:33
688,gp:AOqpTOFHbqBXq7R160clDwPLUI-ABHAnyAFcbNqNn-ySbBbkZFwxv_jukocbANefgkMH6CePxcma0Ene2Hc0Mw,Lord Sam,https://play-lh.googleusercontent.com/a-/AOh14GgIlq1E83BSmQT2rC5Isj5Rk35KZSIdUerVJrDD,Ayo dapetin bonus cashback tiap kali beli Reksadana dengan kode ini (samcobacuan),5,1,3.8.0,2021-04-30 20:30:34,,
689,gp:AOqpTOFkdLWN0nPXVCSX6u2-3_0Eph8Bvrx7fOiQ9JpX_14L8zjNfiMlmDhAhld_HxsAsXoLqe4Warf9oujORQ,Papa Rachel,https://play-lh.googleusercontent.com/a-/AOh14GiRNydpxxu3SxN9sqiZQbGgcpiNYho-aQyTP91NcQ,"Ini aplikasi reksadana paling baik menurut saya. Karna update NAB cepat sekali, dan ada chat online dengan customer service",5,140,3.8.0,2021-05-05 04:39:30,,
690,gp:AOqpTOFmRz_FC70LCGNgnccKdq1bY1C6BOfXuKKlpvOgZAUmKwvKqArLq0UTDve2k8NODemFBINo5zQxVZZX8g,Rizal Dzalkarnaen,https://play-lh.googleusercontent.com/a-/AOh14GiaLSouUp0xETSa_DFObIxiYM_vMR85FmPCWDYbJg,"Server nya knp nih, buka di aplikasi ga bisa buka di web bisa, pdhl udh update aplikasi masih network error",1,0,3.8.0,2021-04-13 10:23:26,"Hai Rizal, silahkan kakak coba untuk force close & clear cache terlebih dahulu, lalu buka kembali aplikasi Bibit nya ya. Jika masih terkendala kakak bisa langsung menghubungi layanan live chat Bibit atau via WA di nomor +622150864230. Terimakasih",2021-04-15 01:06:26
691,gp:AOqpTOGGWsyq7671FDiPgAKzBOM_RM1kKl59ZEtE3Yeis2s_x7CS9ZP85VZCsgp85E42YkUh7KYpFehBjPjjHw,Muhammad Fikri,https://play-lh.googleusercontent.com/a-/AOh14Gj1OZeRh7WPYi_mLJG7DKCVwynD0bjSjRGxPZ8K,"Yang paling aku suka dari bibit adalah, tanpa adanya biaya Admin. Mantap dehh",5,0,3.8.0,2021-04-05 14:18:57,,
692,gp:AOqpTOHWrE_TyqWBh59I_03PPKNYnTWPYmpX-fDPdUv7YGb6U0oSWTwh07E073ie0Om2c60wlH_Cq4Xjwka1FQ,Elvania Elvania,https://play-lh.googleusercontent.com/a-/AOh14GgkXB686Xi7_cGiHJcZ_3SUDIelo4IRnOtnDAj0PfI,"temen2 kalau masukin kode "" ekstrauang "" ini dapet tambahan uangg!!!!",5,0,3.7.1,2021-03-28 05:58:04,,
693,gp:AOqpTOEm2G4p2E0KF5_DZWBWSCDCRJUQuqvVbGwwfuXk9kqQLIYzFqfs_YHa2yZlivk1SfTDWjTe0wk9-HDMfg,Ocky Monteri,https://play-lh.googleusercontent.com/a-/AOh14Gg-et6Tz2yV2N4x7lVV8DL7GOQkPAPiUhArglDX6Q,"Aplikasi investasi yg sangat bagus menurut saya, karena sangat mudah bagi yg ingin menabung dan sangat detail",5,0,3.7.1,2021-04-07 16:43:27,,
694,gp:AOqpTOFg99p30aGlGqlT_IBJyF7GImok2Dp8Z7UvPAKnxJUOX552jem1Gi47mkrQxzGxzXiEuT4hIL55vXyk-A,Jian,https://play-lh.googleusercontent.com/a-/AOh14GjxA4jWVNOC1hhRS-nhjUz0IWGNet2gGd2FzXYPZQ,Bags aplikasi nya cuman sayang pas saya butuh dna mendadak pejualanya lama udah 5 hari blon masuk2 dana saya cb d persingkat aturanya jd 3 hari aja jd pusing saya mau bayar tagihan jd telat kelamaan nunggu uangnya blom masuk,2,0,3.7.1,2021-04-05 23:56:07,"Hai Jian, pencairan reksadana mengikuti NAB jual yg kamu dapat dan akan dikirim Bank Kustodian ke rekening kakak yg terdaftar di Bibit sesuai prosedur maks 3 hari kerja utk reksadana pasar uang dan maks 7 hari kerja utk reksadana saham & obligasi. Jika lebih dari itu bisa hubungi layanan live chat di aplikasi Bibit/via WA +622150864230. Terimakasih",2021-04-06 01:45:04
695,gp:AOqpTOFbSlAzx1PtmA7sKPulb-L4GtI771WC4NKMSiyz-QhBeSSVKqcpwFqUwHbVgMgmcAQahYtQN0isOkRrvw,Bang Bus,https://play-lh.googleusercontent.com/a-/AOh14GivGkKXp-Ulwz47XIqHxgWHz1ahBlmT4ctGfCb9,Investasi semoga beruntung,5,0,3.10.1,2021-05-24 18:57:21,,
696,gp:AOqpTOHczEINtv89Ka8LCpH-35eGtKPYz4sGBITsiUyMjaMwnokref9xdYbIiR9BOOushKPJThl4u2WUUdtCBQ,Hai Nics,https://play-lh.googleusercontent.com/a-/AOh14GixQ32FtDxPUrl96K1ERDBMMR2tB7DjE4ZJh0zY,"Luar biasa, entah apanya yang luar biasa, semoga makin banyak orang yang berinvestasi di bibit amiennnnnnn",5,0,3.7.1,2021-03-27 15:28:13,,
697,gp:AOqpTOG40M5_1C9BiVdGRhK9aDAfXF3XBuiRtWk4TJxHIrq6780SKh1pxYMby1NCXoDyZktnXQHhhWiKjGWQXQ,Sri Kusuma,https://play-lh.googleusercontent.com/a-/AOh14Ghr1qG_84OeWXsNn-ocZIzQlqJiMCfh1jVWiCQMrg,jenis aplikasi reksadana yang sederhana dan cocok banget bagi pemula yg ingin belajar,5,0,3.8.0,2021-04-10 04:12:35,,
698,gp:AOqpTOGL62Hy2C1GSL_j7PK7xMJfXJ89KhRZy2O17zT34R9-C79pM9_oAUZsErSDGYm8e9qwHbUKgTa1LuB6SQ,Bagas Mahardhika,https://play-lh.googleusercontent.com/a/AATXAJyDaprKGTd5fwuTHP3TTbz7DfXuv_K2FKT_gk2c=mo,ini knapa ya saya jual semua reksa dana tapi yg ada di rekening saya cuma 40% .,1,0,3.8.0,2021-05-01 12:32:02,"Hai Bagas, seluruh transaksi di Pasar Modal harus mengikuti regulasi dari OJK ya, termasuk Bibit. Batas waktu pencairan dana Reksadana ke rekening nasabah yg dikirim oleh Bank Kustodian maks 3 hari kerja utk RD Pasar Uang dan maks 7 hari kerja utk RD Saham & Obligasi. Info lebih lanjut silahkan hubungi live chat Bibit/WA +622150864230. Terimakasih",2021-05-03 04:34:02
699,gp:AOqpTOEfHODrwIeRmXASUEVduIusH1shSGvWAMtoSNVD-LPby4nExr4T3Yf_mdJvx9KBWCKIU4VanFeHpwDstw,sari mulyana,https://play-lh.googleusercontent.com/a-/AOh14GiUZX56oRLrHEfpotBTo7F7TONCsk8WZtuMf7Odbw,"Bagus, minimalis menu, mudah di mengerti, yok semangat investasi",5,0,3.8.0,2021-04-14 00:03:04,,
700,gp:AOqpTOHPwZ9gL67t0yZncpWtndT9HzxJTPMxqXkZx0d6IGx9Wh5UhlmjXOflCGbryZ1lBEkPk-Px_TirZZB0ZQ,Fitri Nurhayati,https://play-lh.googleusercontent.com/a-/AOh14GiebGXmyMzH30wh7fWkCn2zgnhPzGo-0NjdRnMeLw,Masukkan kode reveral : sinada agar dapat Cashback 25k,5,0,3.10.1,2021-05-23 13:05:42,,
701,gp:AOqpTOHKQDSJLVEgqJlVBtyn08-2SRj6ayD-C8yWMPuaHQYC89MckkHF4dpmXY7ZHMvmEtbPSQD15HFQURebMw,Anam Subekti,https://play-lh.googleusercontent.com/a-/AOh14GgeXoWfUOxU761kD6ARr6HjoLgsLnxfRJE2ELcPZw,Pembelian pertama min berpa sih.kok 100 tombol belinya kaga ijo,4,0,3.10.1,2021-05-28 06:17:15,,
702,gp:AOqpTOFnBfkqpVOA3ZDgQJ2MwlN-NxKKbuf4ZkwLiQfV0Srfod9INFx9Fn0m4JZV3gmsaKaF-3ySrlsp5mgrZQ,Erick Eristiawan,https://play-lh.googleusercontent.com/a-/AOh14GgF17hM3zGc2x4EqM6TkHwI9ArwDX9Cu5etGYolKw,Sudah berhasil terjual tapi tidak sesuai yang masuk ke rekening,1,0,3.8.0,2021-05-19 00:18:32,"Hai kak, pencairan dana dikirim oleh Bank Kustodian secara bertahap ke rekening terdaftar di Bibit sesuai dgn NAV jual yg didapat max 7 hari kerja berdasarkan regulasi OJK. Jika rekening berbeda dgn Bank Penampung, ada biaya transfer Rp 2.500-6.500 per Reksadana yg dikenakan oleh pihak bank. More info hubungi live chat Bibit/WA +622150864230. Trims",2021-05-20 09:16:20
703,gp:AOqpTOFQ5gU20ET0nu1WaHd4MRYGwZdhqV92lhzO3uwoicqzgBG7gcnuVjmfrm8NfipFFuhaz3Lq7Voum4kf6w,Umar Abdul Aziz,https://play-lh.googleusercontent.com/a-/AOh14Gi44CtAQrBgvVwutGhlTRcEz7uJTRxq7RT4XIuhEw,pengalaman investasi bersama bibit. naik turunnya pasar saham tidak terasa ketika menerapkan program DCA.,5,0,3.8.0,2021-04-09 11:11:01,,
704,gp:AOqpTOFDV4LW1INKNLGG04VxqK6SYLG6zzJLk2phjfphKKZzKSnXDyiVAbPMAt2SwdkYrezKri10yguKJgNdxg,Abdul Aziz,https://play-lh.googleusercontent.com/a/AATXAJziyuKNj83gKh62YGUe44gMKtPuTES9pW-F644-=mo,Semoga bisa amanah terus sepanjang masa ...layanannya mudah dan cepat mantap dech,5,0,3.8.0,2021-04-13 10:59:08,,
705,gp:AOqpTOF34_06LsRBaG6YdB1o9j0ZBAdosNZQcSATf9CHLnRVtbkIhn_Ciw37kgVbmSoFTgv-wDfavR_-HGkk4Q,Willy aby Micky,https://play-lh.googleusercontent.com/a-/AOh14GhdcRXBbAATNgQwb9hMcAxe96iIcJdWKPE1pTTU2g,"Kode referal untukkitaaa untuk 25k.. Jujur aja ini yg paling bisa d percaya sih kalo menurutku, sayangnya bnyk yg mengatas namakan bibit di telegram terutama, jadi hati2 kalo ada yg menawarkan titip investasi jangan percaya y",5,0,3.7.1,2021-04-05 00:25:10,,
706,gp:AOqpTOGrZE8Egz1zITn_vqPzrMdtWvjOAAQcU830i9vLCQR7jSGOFreXD4u5Xlm2H9oqm7DciqBo4FnTLMttLw,muhamad faozan,https://play-lh.googleusercontent.com/a-/AOh14GgDmxvgIIjAkV8l0Ha08D8l7DrnQHmXnJbeE76dAw,Kok setelah update aplikasi nya keluar mulu ya.. Gak bisa login? User poco x3,1,0,3.7.1,2021-03-24 09:43:26,"Hai kak, silahkan kakak coba untuk force close & clear cache terlebih dahulu, lalu silahkan kakak buka aplikasi Bibit nya kembali ya. Jika masih terkendala kaka bisa menghubungi layanan live chat Bibit atau via WA di nomor +622150864230. Terimakasih",2021-03-25 01:47:16
707,gp:AOqpTOGOnNGPsF6FfyF8N3AptcVCJwDymi-nvTd8oDel6HOELOPznWYQ0WTv1-MbD_V_8TcwuVecPYUoMGTerw,Irsyad Rafi,https://play-lh.googleusercontent.com/a/AATXAJzF0lj0jMRCPOzXUs-GYKRW8v3dMxh8PzWeLVn7=mo,Gimana mau registrasi nomor hp aja salah trus padahal bener trus alamat Gmail udh bener salah terus lah mau gimana login anjjjj,1,0,3.8.0,2021-04-15 02:35:01,"Hai Irsyad, untuk masalah registrasi bisa langsung hubungi tim support lewat aplikasi atau melalui WA di nomor +622150864230 agar dapat langsung dibantu masalahnya. Terimakasih",2021-04-16 05:01:21
708,gp:AOqpTOEK_2Acv-SUXZFK15-zBv8h0QCaVVjllBgZYrAJjK7IX4LY_t0s2xsL0DEqwocy82rGBjYbtlBd3b--0g,Irfan Achmad,https://play-lh.googleusercontent.com/a-/AOh14GhDmY_DY7qGfFLwLZS94Rhiixd2tq5a7W4yPaQv0w,"Masukan aj nih, utk penambahan nmor rekening jgn pakai fto buku rekening donk. Kn skg sdh jamannya rek onloline tanpa bku rekning, sperti jenius n tmrw. Ini sya jdi gk bisa tambah rekening krn gk ad bku rekeningnya",3,1,3.8.0,2021-05-06 03:24:11,,
709,gp:AOqpTOFpXHJzBri6nj4Wt90rms4fntqAl5pECw7whAxFMNXXphtiDkCMJb0mUsE43NAi-uFueAJKJVGh4AHKOA,Lusa,https://play-lh.googleusercontent.com/a-/AOh14GgifVkDGNPHUEVMvk3pOkUiq5wEAH7fKQRHTudrVQ,Jangan install bro.. WD nya lama banget.. Nyesel dah gua :(,1,0,3.8.0,2021-05-09 16:05:21,"Hai kak, seluruh transaksi di Pasar Modal harus mengikuti regulasi dari OJK ya, termasuk Bibit. Batas waktu pencairan dana Reksadana ke rekening nasabah yg dikirim oleh Bank Kustodian maks 3 hari kerja utk RD Pasar Uang dan maks 7 hari kerja utk RD Saham & Obligasi. Info lebih lanjut silahkan hubungi live chat Bibit/WA +622150864230. Terimakasih",2021-05-10 04:44:48
710,gp:AOqpTOEuFoS6NTL0TTsqeJEfn8cIxIqoi8Yv4byBFCXAPDmLL4jzTUjEdY_flCAWXIdPNSx17kFdG8-hraRRFQ,Chandra Budhi Rizky,https://play-lh.googleusercontent.com/a-/AOh14GiUm1-tKcEaRJ42JE0qpOx4ua_eWxC-CUyvMk05yQ,"Ada apa dengan aplikasi bibit, tiap update malah tidak ada koneksi. Mesti install ulang hp bukan aplikasinya 🙃",1,14,3.9.1,2021-05-04 21:25:46,"Hai Chandra, silahkan kakak coba untuk force close & clear cache terlebih dahulu, lalu kakak buka aplikasi Bibit nya kembali ya. Jika masih terkendala kakak bisa menghubungi layanan live chat Bibit atau WA di nomor +622150864230. Terimakasih",2021-05-06 02:20:45
711,gp:AOqpTOGE0tQmN-c0QYEO6OYT-VN6zm-qkvkl_zN_o17JrmZguLxZ50EUcnChqtZuIv4CD9zIIGw0I0bOrinyDA,YABASTIN PULSA,https://play-lh.googleusercontent.com/a/AATXAJxrDRL4-ufD5YJkZKuzgf4fUZeryMGf32FVRAxq=mo,Mohon kalau bisa adakan pdf cara invesnya,5,0,3.10.1,2021-05-26 03:57:36,,
712,gp:AOqpTOEDtyPMj6vpnwrgMHe04WHYjIxnXXV-iZib63hq8JyY9IrcqZJO9274vEXSGyea53rLjS-rcfInRMnuXA,gisela Angelia,https://play-lh.googleusercontent.com/a/AATXAJweJo72sBvOaUhvOq_vMl4vYdnZ3W8Aq5dwH20=mo,"Pakai kode refferal saya: ""v9pdwzk"" dan dapatkan cashback 25.000 untuk pembelian Reksadana",5,0,3.7.1,2021-03-28 09:08:23,,
713,gp:AOqpTOEgRjDlQLmtXtdTGMstyJMiUrBfOBJ4R4JGqsTu1MTY0NyJBG-9Cw8V600xB4RGr6QMOB2eKeYrIZ_-EQ,Annis Fia,https://play-lh.googleusercontent.com/a/AATXAJzVeNnnwokla-2dChwzJp8shHcDx7ikc0XioQ80=mo,Punya ku tidak bisa di buka😢,4,0,3.10.1,2021-06-02 16:09:23,,
714,gp:AOqpTOGOvRZBNWlRR-hnqMggD2mxNWJxjrMNlR8PUG20piE2JNmSf_GKXzpP2C_xuU6-POmiEwtZYqJFcVLRNA,Iraa Nur'aeni,https://play-lh.googleusercontent.com/a-/AOh14GiQao1rFLE-OdvveJKcBU5XYTK182PKLfLKFcENhA,"Angai pemula, jujur sih nyaman bngt dan enak aja gtu rasanya, kek d kasih panduan... tapi gak ribet, mksii bibit",5,0,3.8.0,2021-04-05 22:06:51,,
715,gp:AOqpTOFwHNG0KYeaEDtp4AamCy2Z0HKyEHAYjkom63aNB7EFUO5kraNBN-HNrcdg5iF8YUlUIJTqAA6BT1fxNA,Erwin Ernando,https://play-lh.googleusercontent.com/a-/AOh14GgCqaG4ePLMWUd_3hkhRVOkX-kUZVZNJr_Pne_Pyg,"Free 25k, pake kode: erwindo",5,0,3.10.1,2021-06-02 17:54:44,,
716,gp:AOqpTOG5wPEkB5T-2eIbqCKb6I9nedphOAWk-050CqDgCgxE6J5bCVuKJLBLyZSpOGhESgfXJZhUu9oqj1KDZw,Indah Yuliana,https://play-lh.googleusercontent.com/a-/AOh14Gi1VSXLKOTC9xg6U4sTQORjb1aP9tFbSj89cWyFjw,yuk mulai inves sedini mungkin. gak banyak. penting rutiin :),5,0,3.8.0,2021-05-27 13:51:12,,
717,gp:AOqpTOED6hf82IP0OY7e-CbNzHor1Ilesmj87gNVWJxypUSovJkZgWFot8FJ_nWXQKY8s9LXIyxlOCCmqU_d4g,Tukang Update,https://play-lh.googleusercontent.com/a-/AOh14GgZcVsd4Z8occDsLWGivTFyxFo6P0Rv1weuixPe-A,"mudah di operasikan dan sangat membantu buat berinvestasi, terutama bagi pemula",5,0,3.8.0,2021-04-14 05:28:43,,
718,gp:AOqpTOHSEcdILkUM9McjAh2TvjEGm_AazzwvgE0o-aM6woVb87c6FEb1KG5gXxWak51JABc1typ6j7aRgurlcA,Andru Siregar,https://play-lh.googleusercontent.com/a/AATXAJybro1Ofr_D-16-nanzHi5S5JMkT0uTfnAaqusk=mo,Investasi buat jaminan masa depan yang sejahtera dan bisa buat warisan ke anak cucu,5,0,3.7.1,2021-03-28 05:25:51,,
719,gp:AOqpTOFdPisCBXq_muw2HPrkFDccxc0QqxIXF1b4l6D7g1BkVmHaDBQM6JaGhizY8cZdxJhsaxa-kQxOSbZZIw,Muhamad Raffi,https://play-lh.googleusercontent.com/a/AATXAJzj-WF975a_F9TJ2hhC3T9Uoyl4YaT4Ig8yFrfE=mo,"cocok banget buat nabung, di bibit ini ga ngapa ngapain malah nambah bukan mengurang saldo nya apalagi kalau rajin nabung nya beuh mantepppp",5,0,3.8.0,2021-04-09 23:00:12,,
720,gp:AOqpTOGD3gLj6DoO-FyH9ykvbhEHv8jM48hCMHk3Y6wOXCpKvkSR0bkbzyaO_zP38eEV_y4wIZxa3ATdVKlOTQ,Fanny Alvian,https://play-lh.googleusercontent.com/a/AATXAJyR2iwZ_ZHXCC0FyYqH2T9NmZXEElAkLinvysY4=mo,"Dari 18 januari, sepemantauan sy cuma sekali nilai portofolio sy naik itu sekitar 2 hari. Sisanya minus terus......",1,28,3.8.1,2021-04-30 13:40:51,"Hai Fanny, NAB dpt berubah mengikuti keadaan ekonomi & kinerja Manajer Investasi. Sebaiknya investasi dilakukan rutin utk memperoleh harga rata-rata reksadana terbaik di berbagai kondisi pasar (naik/turun). Manfaatnya ketika pasar sedang turun akan terhindar dari kerugian yg terlalu besar. Info lebih lanjut hubungi live chat Bibit/WA +622150864230.",2021-05-01 01:39:26
721,gp:AOqpTOFNFdY2YA8V7S3bMqMgsDbnEXA5U-8ShQJTBCakMfQf0pQppWl6iKvbqCwB5hb8RFhypxgBCFYPDRswnw,Fathor Alexis,https://play-lh.googleusercontent.com/a-/AOh14Gjxew8XIBG2L8SayJI-caIkOrpfv4C41A0x1bOx,Aplikasinya sangat bagus mudah dipahami bagi investor pemula,5,0,3.8.0,2021-05-19 10:40:27,,
722,gp:AOqpTOHPg1CwLB8G8psS1WEGjI0EIUxkkdJIxRO8-njp3PxiHvoWKnw9-pwrNGieeoy7_6FWvBeg4EfgeQjVHQ,danil oktavian,https://play-lh.googleusercontent.com/a-/AOh14GheWCaIfNe3Ie9B_LZgQFbyGLrR9w1ZX1zDEoP7zg,"pembelian mudah, jual juga cepat. biaya transfer diganti dengan cashback.",5,0,3.7.1,2021-03-29 13:45:58,,
723,gp:AOqpTOGyJF_o8nSCdDZBjKjH153VjPjGwVcO-ow0bjBdNTvur3SKIE_pfi6hOhDQiV5XS9uFhlo2uA7zFn_2yg,Muhammad Barry,https://play-lh.googleusercontent.com/a-/AOh14Gix0iUsszJcZck-F-qgMhty44W_HUauyB6AkPQ6KA,Ko uang saya belom di imrpove ya padahal udah dari Minggu Sabtu kemarin saya top up?,2,0,3.8.0,2021-05-03 06:47:04,"Hai kak, mohon ditunggu transaksi pembelian akan berhasil maks 1 hari kerja ya kak. Seluruh transaksi pembelian maupun penjualan diproses mengikuti batas waktu transaksi pada hari bursa yang berlaku di luar hari Sabtu, Minggu dan Libur Nasional. Untuk info lebih lanjut hubungi layanan live chat Bibit atau WA di nomor +622150864230. Terimakasih",2021-05-04 02:14:09
724,gp:AOqpTOGOv62ewbQUJzrsILoGtKG6SLQd0xwxaBAnVr2oi-dQs09xIrp7GO-b9Xp0qDQLg3Izy0wnN7Xv_6S93w,hansyah martha,https://play-lh.googleusercontent.com/a/AATXAJyGYT1wadwsGEsQFX4dOqJk75RV9fA_I1UZ-kzq=mo,Pihak bibit tolong dong sediakan pembayaran via aplikasi dana. Terima kasih,5,0,3.7.1,2021-04-15 06:26:11,,
725,gp:AOqpTOGVUCioLnZOhfSsweudnQlnZ1nCnsTmtuDxUMCjL45DTvHTrwIXonq_qdl7_VLQgtrvk3ZEAr3_VJH4Nw,Yunita Dwi Cahyaningtias,https://play-lh.googleusercontent.com/a-/AOh14GgUCtmZ38pG9mcFL_cj4xqqC7C1LsKHlTt6NC6Utg,"Jangan lupa pakai kode referal ""Cauncrn"" biar dapet cashback ya!",5,0,3.8.0,2021-04-08 00:25:38,,
726,gp:AOqpTOHhDSFhdggDikORsyV8MPvv5Hkx73raXcoZblDLhcoADoCB8V1a7CQN3EJT-8YTbomoOLZOoubKqMxs5Q,A'agus syaputra,https://play-lh.googleusercontent.com/a-/AOh14Gi3QN-Az823Lk4GPsEhfBOQAlkuyplPwLWxcmC6,investasi yang sangat bagus,5,0,3.10.1,2021-06-04 06:22:39,,
727,gp:AOqpTOE8OZLrTOQvwlPJdzptc7RmggwsdT4Ra3YInEvQEMQa84-pFEH69EW0WRWEHybCCQeqT7m7wsM2G7wiQA,Aledonfus Beno,https://play-lh.googleusercontent.com/a/AATXAJxmLm5LY6Q38kEUNgUPvZoPk-9OSle36etV6a1K=mo,Oke banget deh buat pemula,5,0,3.10.1,2021-06-03 22:02:48,,
728,gp:AOqpTOEPUtTgt1MSx4pvF6E3Fx2738AQ3sLMfKwrTZ-4iYIx4yFKloDD-AVsvL2dkO_B_3QBWWvMFLLzXriZwg,RAJU channel,https://play-lh.googleusercontent.com/a-/AOh14Gi1qREcVrgAOdkNx1eN9xy27X4sey1eDxIGVWlv,aplikasi yg sangat membatu,5,0,3.10.1,2021-05-31 16:11:59,,
729,gp:AOqpTOH0ZW2lNl_DMKXOUvL2HUK7onHz2NI35vO0SNpZ9PpMek2AcxDT0mdggR5A4AwsGpL1F3tgs2894FP4RA,TUGU Family,https://play-lh.googleusercontent.com/a-/AOh14Gj-fSKXYKddBcDY2WDuEpCJuzEBPMh1kiSpMBzljQ,JOIN sama aplikasi DANA dong !,5,0,3.10.1,2021-05-24 17:53:53,,
730,gp:AOqpTOEgdl06qsn7X74LT0E6i-2WAIEwY12I4SbD6KZ0oX_lZMenJean213EZnL4AMc5KwZ-OVCzPBmwYNj6aA,ester mega,https://play-lh.googleusercontent.com/a-/AOh14GioypHftCawOc-mgEe_fgZXqvcLNReestomwpom,lagi coba aplikasinya ni..semoga cocok..jangan lupa pake kode referalnya punya saya : inxiwep,4,0,3.7.1,2021-04-06 00:45:01,,
731,gp:AOqpTOHAsn4OfBFcExQOrgsiCUhwA9I7e3GWIjL27DGq2Y7TUpZWlKALZ0FbFz1kXOFJcIuIHQZGTs9vTNr0HA,anak Sunda tea geuning,https://play-lh.googleusercontent.com/a-/AOh14GgcAe0KfFx7p0jNIiSTbUDMiAbkQzyRrQcdFQHpjw,lumayan buat investasi mah,5,0,3.10.1,2021-05-29 04:41:05,,
732,gp:AOqpTOHGu4DA3yeIwERKXfHFTbME3P8QaMFXob0wPAVp9MDUWA_75kRKTRYPKp5b_KCoNx9wPt-hQ3AzNPFu0A,Weldrin Waremra,https://play-lh.googleusercontent.com/a-/AOh14GhAYodxTDbGgNpJhDe6N-G82hI6xHAMpmVE6IWuIA,"terbaik dlm hal investasi dan nabung jangka pendek, menengah, maupun jangka panjang.",5,1,3.7.1,2021-03-27 12:29:02,,
733,gp:AOqpTOE8yHLdRcGk09O8RClEQ8WgpXW7HYkjKIkib184JiTKULMUrVzHg0hrWG9U0o4FzYASjNtUdg2F0hf06Q,rani marbun,https://play-lh.googleusercontent.com/a/AATXAJwOezBEzIp18kc3Pilo7_NyB2vlloUsnGTO0mcN=mo,Pas jual ga kena potongan biaya krn bank custodian sama rek bank kita sama...good lah,5,0,3.8.0,2021-04-16 02:45:18,,
734,gp:AOqpTOE3ADFVMwXIRyd0go6g8uF-9sZXj5aekbNkJZELmRmmGlHYRqVb0CbRtBsKk6t8Qz7SS8LgMy_T47iayw,Yuliusgi Arts,https://play-lh.googleusercontent.com/a-/AOh14Gj_JLTktn8uBDWUy5yayzGRFU6dp9lKjt5RU43-Dw,masih baru di bibit. tp bibit sangat membantu sekali utk pemula yg baru mulai belajar investasi reksadana,5,0,3.7.1,2021-03-27 05:50:07,,
735,gp:AOqpTOEYiBMF04abNFHF7tEV_1wi72vMNt2vr3Ptkr40H0YJ4np52HyavJdBWYa7GQaouBhFIPZCEIZ1SX9X7w,Afia 18,https://play-lh.googleusercontent.com/a/AATXAJxPUEBBQ9J2scOtDKRkSHjNGhcFTiYyIeFP4mwj=mo,Aplikasi jelek... setelah di deposit aplikasi tidak bisa lagi di buka.,1,1,3.8.0,2021-04-26 11:48:42,"Hai Afia, untuk masalahnya harap langsung hubungi tim support lewat live chat pada aplikasi Bibit atau WA di nomor +622150864230 agar dapat langsung dibantu masalahnya. Terimakasih",2021-04-27 05:45:17
736,gp:AOqpTOGkNkjDD-LXjOlgrjyAQhLIarYFbl1nOOI_GLn0APg7gVTctqXvVeuk1OAYh6DggPSyB6V3-MgyOcJvZg,Fuad Bawazir,https://play-lh.googleusercontent.com/a-/AOh14GgtugOSpZFPMUq-k6_jmt9Jbp7wLsI_8NGvd9Td,Aplikasi ga bisa di buka,1,0,3.10.1,2021-05-25 12:00:56,"Hai kak Fuad, terkait kendalanya silahkan kakak coba untuk force close & clear cache terlebih dahulu ya, lalu kakak buka aplikasi Bibit nya kembali. Jika masih terkendala harap langsung menghubungi layanan live chat Bibit atau WA ke nomor +622150864230 agar dapat tim kami tangani lebih lanjut. Terimakasih",2021-05-27 09:29:48
737,gp:AOqpTOEdIQ-Iy2P5RVvgRk3YIguXQZbfqBO3_UZGMe264iWO6RPAGrlSq_lC0fNYl8DXlnGO2qBeMpm0Afqfqg,Nas Rull,https://play-lh.googleusercontent.com/a-/AOh14GjzzqfT8FvcW2iOqCHQt5JGKO7prW_ySrjRFAVYmw,"selama ini pengalaman saya memakai bibit, sangat baik, semoga ekonomi indonesia semakin membaik",5,0,3.8.0,2021-04-14 17:05:15,,
738,gp:AOqpTOHzH0XgrHeXHgL3OSQASVxIibqi-TBkPMUf32HBO2u7PmfdWjFjcJ8rWA4NvA_AeG8bU8YvB8gmRRAEHQ,Negi Style,https://play-lh.googleusercontent.com/a-/AOh14Ghz2d8AysyrCpwiOr9nKSt3Wcf8YT-Pjj2I9hqeng,"Registrasinya ga bisa pas yang upload foto udh difoto berkali"" ga bisa , makasih",1,0,3.7.1,2021-04-05 02:05:16,"Hai kak, mohon maaf atas ketidaknyamanannya. Terkait kendalanya, kakak bisa menghubungi tim support kami pada layanan live chat atau via wa di nomor +622150864230 untuk ditangani lebih lanjut. Terimakasih",2021-04-05 09:23:50
739,gp:AOqpTOG1CrKdpHIwOf2CCpOFJeBc2PLFJWCm9vSDNfPPSjv9hNr3ogFGew4KLAVxXYSoDNnbYFYXwUfhtU40SA,Efa May,https://play-lh.googleusercontent.com/a-/AOh14GhDm2z2MUNljhsMknESIqmySPFo6hnINDjktBGa2-w,"pertama buat sy ikut investasi reksadana, sejauh ini lancar saat transaksi",5,0,3.7.1,2021-03-29 03:43:13,,
740,gp:AOqpTOH1GMmZZN2tL4hU0Z-MYioPOHzlP7XJQ_XDN4Ynvb6XeJv-oKSJriy5yXW-XHmyDR8pkMUpAgV9XPAYtw,Sweet Watermelon,https://play-lh.googleusercontent.com/a-/AOh14GjVEMYIB7ywenzN_yNG0NXxaOjaRM_I2gmAUUa-wQ,Tolong dong kasih opsi untuk hapus akun.. saya mau hapus akun tapi gak bisa :(,1,0,3.8.0,2021-05-05 02:14:36,"Hai kak, akun Bibit tidak dpt dihapus karena sistem kami terhubung dgn sistem KSEI & sistem KSEI tidak mengijinkan kami utk menghapus akun kakak. Bibit sudah mengikuti standar keamanan lembaga keuangan. Data kamu Bibit simpan dengan menggunakan enkripsi AES-256, yg merupakan sistem enkripsi umum dipakai oleh lembaga2 keuangan lainnya. Terimakasih",2021-05-06 02:25:22
